perf/model_parity_full/rust/layout/realworld/ptolemy/hierarchical/backtrack_trialmodule_TrialModuleNonBacktrack.elkg.json

{"children":[{"height":40.0,"id":"N1","labels":[{"height":15.0,"id":"L1","text":"Backtrack","width":59.0,"x":0.0,"y":-20.0}],"layoutOptions":{"org.eclipse.elk.nodeLabels.placement":"[H_LEFT, V_TOP, OUTSIDE]","org.eclipse.elk.portConstraints":"FIXED_ORDER"},"ports":[{"height":8.0,"id":"P1","layoutOptions":{"org.eclipse.elk.port.index":"0","org.eclipse.elk.port.side":"WEST"},"width":8.0,"x":-8.0,"y":8.0},{"height":8.0,"id":"P2","layoutOptions":{"org.eclipse.elk.port.index":"-1","org.eclipse.elk.port.side":"WEST"},"width":8.0,"x":-8.0,"y":24.0},{"height":8.0,"id":"P3","layoutOptions":{"org.eclipse.elk.port.index":"2","org.eclipse.elk.port.side":"EAST"},"width":8.0,"x":60.0,"y":16.0}],"width":60.0,"x":725.0,"y":32.0},{"height":25.0,"id":"N2","labels":[{"height":15.0,"id":"L2","text":"StringConst","width":68.0,"x":0.0,"y":-20.0}],"layoutOptions":{"org.eclipse.elk.nodeLabels.placement":"[H_LEFT, V_TOP, OUTSIDE]","org.eclipse.elk.portConstraints":"FIXED_ORDER"},"ports":[{"height":8.0,"id":"P4","layoutOptions":{"org.eclipse.elk.port.index":"0","org.eclipse.elk.port.side":"EAST"},"width":8.0,"x":38.0,"y":8.5},{"height":8.0,"id":"P5","layoutOptions":{"org.eclipse.elk.port.index":"-1","org.eclipse.elk.port.side":"WEST"},"width":8.0,"x":-8.0,"y":8.5}],"width":38.0,"x":20.0,"y":368.29166666666663},{"height":31.0,"id":"N3","labels":[{"height":15.0,"id":"L3","text":"Display","width":43.0,"x":0.0,"y":-20.0}],"layoutOptions":{"org.eclipse.elk.nodeLabels.placement":"[H_LEFT, V_TOP, OUTSIDE]","org.eclipse.elk.portConstraints":"FIXED_ORDER"},"ports":[{"height":8.0,"id":"P6","layoutOptions":{"org.eclipse.elk.port.index":"0","org.eclipse.elk.port.side":"WEST"},"width":8.0,"x":-8.0,"y":11.5}],"width":41.0,"x":725.0,"y":341.79166666666663},{"height":47.0,"id":"N4","labels":[{"height":15.0,"id":"L4","text":"BooleanSelect","width":84.0,"x":0.0,"y":-20.0}],"layoutOptions":{"org.eclipse.elk.nodeLabels.placement":"[H_LEFT, V_TOP, OUTSIDE]","org.eclipse.elk.portConstraints":"FIXED_ORDER"},"ports":[{"height":8.0,"id":"P7","layoutOptions":{"org.eclipse.elk.port.index":"0","org.eclipse.elk.port.side":"WEST"},"width":8.0,"x":-8.0,"y":10.333333333333334},{"height":8.0,"id":"P8","layoutOptions":{"org.eclipse.elk.port.index":"-1","org.eclipse.elk.port.side":"WEST"},"width":8.0,"x":-8.0,"y":28.66666666666667},{"height":8.0,"id":"P9","layoutOptions":{"org.eclipse.elk.port.index":"-2","org.eclipse.elk.port.side":"SOUTH"},"width":8.0,"x":16.5,"y":47.0},{"height":8.0,"id":"P10","layoutOptions":{"org.eclipse.elk.port.index":"3","org.eclipse.elk.port.side":"EAST"},"width":8.0,"x":41.0,"y":19.5}],"width":41.0,"x":980.0,"y":68.99999999999999},{"height":25.0,"id":"N5","labels":[{"height":15.0,"id":"L5","text":"Not Rollback","width":74.0,"x":0.0,"y":-20.0}],"layoutOptions":{"org.eclipse.elk.nodeLabels.placement":"[H_LEFT, V_TOP, OUTSIDE]","org.eclipse.elk.portConstraints":"FIXED_ORDER"},"ports":[{"height":8.0,"id":"P11","layoutOptions":{"org.eclipse.elk.port.index":"0","org.eclipse.elk.port.side":"EAST"},"width":8.0,"x":22.0,"y":8.5},{"height":8.0,"id":"P12","layoutOptions":{"org.eclipse.elk.port.index":"-1","org.eclipse.elk.port.side":"WEST"},"width":8.0,"x":-8.0,"y":8.5}],"width":22.0,"x":878.0,"y":120.5},{"height":25.0,"id":"N6","labels":[{"height":15.0,"id":"L6","text":"Const","width":34.0,"x":0.0,"y":-20.0}],"layoutOptions":{"org.eclipse.elk.nodeLabels.placement":"[H_LEFT, V_TOP, OUTSIDE]","org.eclipse.elk.portConstraints":"FIXED_ORDER"},"ports":[{"height":8.0,"id":"P13","layoutOptions":{"org.eclipse.elk.port.index":"0","org.eclipse.elk.port.side":"EAST"},"width":8.0,"x":38.0,"y":8.5},{"height":8.0,"id":"P14","layoutOptions":{"org.eclipse.elk.port.index":"-1","org.eclipse.elk.port.side":"WEST"},"width":8.0,"x":-8.0,"y":8.5}],"width":38.0,"x":20.0,"y":123.66666666666666},{"height":25.0,"id":"N7","labels":[{"height":15.0,"id":"L7","text":"SampleDelay","width":77.0,"x":0.0,"y":-20.0}],"layoutOptions":{"org.eclipse.elk.nodeLabels.placement":"[H_LEFT, V_TOP, OUTSIDE]","org.eclipse.elk.portConstraints":"FIXED_ORDER"},"ports":[{"height":8.0,"id":"P15","layoutOptions":{"org.eclipse.elk.port.index":"0","org.eclipse.elk.port.side":"WEST"},"width":8.0,"x":-8.0,"y":8.5},{"height":8.0,"id":"P16","layoutOptions":{"org.eclipse.elk.port.index":"1","org.eclipse.elk.port.side":"EAST"},"width":8.0,"x":41.0,"y":8.5}],"width":41.0,"x":377.0,"y":123.66666666666666},{"height":37.0,"id":"N8","labels":[{"height":15.0,"id":"L8","text":"ResourcePool","width":81.0,"x":0.0,"y":-20.0}],"layoutOptions":{"org.eclipse.elk.nodeLabels.placement":"[H_LEFT, V_TOP, OUTSIDE]","org.eclipse.elk.portConstraints":"FIXED_ORDER"},"ports":[{"height":8.0,"id":"P17","layoutOptions":{"org.eclipse.elk.port.index":"0","org.eclipse.elk.port.side":"EAST"},"width":8.0,"x":103.0,"y":14.5},{"height":8.0,"id":"P18","layoutOptions":{"org.eclipse.elk.port.index":"-1","org.eclipse.elk.port.side":"WEST"},"width":8.0,"x":-8.0,"y":14.5}],"width":103.0,"x":831.0,"y":33.5},{"children":[{"height":31.0,"id":"N10","labels":[{"height":15.0,"id":"L10","text":"StringFunction","width":85.0,"x":0.0,"y":-20.0}],"layoutOptions":{"org.eclipse.elk.nodeLabels.placement":"[H_LEFT, V_TOP, OUTSIDE]","org.eclipse.elk.portConstraints":"FIXED_ORDER"},"ports":[{"height":8.0,"id":"P22","layoutOptions":{"org.eclipse.elk.port.index":"0","org.eclipse.elk.port.side":"WEST"},"width":8.0,"x":-8.0,"y":11.5},{"height":8.0,"id":"P23","layoutOptions":{"org.eclipse.elk.port.index":"1","org.eclipse.elk.port.side":"EAST"},"width":8.0,"x":81.0,"y":11.5}],"width":81.0,"x":219.0,"y":183.0},{"height":41.0,"id":"N11","labels":[{"height":15.0,"id":"L11","text":"StringSubstring1","width":97.0,"x":0.0,"y":-20.0}],"layoutOptions":{"org.eclipse.elk.nodeLabels.placement":"[H_LEFT, V_TOP, OUTSIDE]","org.eclipse.elk.portConstraints":"FIXED_ORDER"},"ports":[{"height":8.0,"id":"P24","layoutOptions":{"org.eclipse.elk.port.index":"0","org.eclipse.elk.port.side":"WEST"},"width":8.0,"x":-8.0,"y":4.25},{"height":8.0,"id":"P25","layoutOptions":{"org.eclipse.elk.port.index":"1","org.eclipse.elk.port.side":"EAST"},"width":8.0,"x":61.0,"y":16.5},{"height":8.0,"id":"P26","layoutOptions":{"org.eclipse.elk.port.index":"-2","org.eclipse.elk.port.side":"WEST"},"width":8.0,"x":-8.0,"y":16.5},{"height":8.0,"id":"P27","layoutOptions":{"org.eclipse.elk.port.index":"-3","org.eclipse.elk.port.side":"WEST"},"width":8.0,"x":-8.0,"y":28.75}],"width":61.0,"x":90.0,"y":178.0},{"height":25.0,"id":"N12","labels":[{"height":15.0,"id":"L12","text":"Const1","width":42.0,"x":0.0,"y":-20.0}],"layoutOptions":{"org.eclipse.elk.nodeLabels.placement":"[H_LEFT, V_TOP, OUTSIDE]","org.eclipse.elk.portConstraints":"FIXED_ORDER"},"ports":[{"height":8.0,"id":"P28","layoutOptions":{"org.eclipse.elk.port.index":"0","org.eclipse.elk.port.side":"EAST"},"width":8.0,"x":18.0,"y":8.5},{"height":8.0,"id":"P29","layoutOptions":{"org.eclipse.elk.port.index":"-1","org.eclipse.elk.port.side":"WEST"},"width":8.0,"x":-8.0,"y":8.5}],"width":18.0,"x":20.0,"y":159.625},{"height":25.0,"id":"N13","labels":[{"height":15.0,"id":"L13","text":"Const2","width":42.0,"x":0.0,"y":-20.0}],"layoutOptions":{"org.eclipse.elk.nodeLabels.placement":"[H_LEFT, V_TOP, OUTSIDE]","org.eclipse.elk.portConstraints":"FIXED_ORDER"},"ports":[{"height":8.0,"id":"P30","layoutOptions":{"org.eclipse.elk.port.index":"0","org.eclipse.elk.port.side":"EAST"},"width":8.0,"x":18.0,"y":8.5},{"height":8.0,"id":"P31","layoutOptions":{"org.eclipse.elk.port.index":"-1","org.eclipse.elk.port.side":"WEST"},"width":8.0,"x":-8.0,"y":8.5}],"width":18.0,"x":20.0,"y":224.625},{"height":41.0,"id":"N14","labels":[{"height":15.0,"id":"L14","text":"StringSubstring2","width":97.0,"x":0.0,"y":-20.0}],"layoutOptions":{"org.eclipse.elk.nodeLabels.placement":"[H_LEFT, V_TOP, OUTSIDE]","org.eclipse.elk.portConstraints":"FIXED_ORDER"},"ports":[{"height":8.0,"id":"P32","layoutOptions":{"org.eclipse.elk.port.index":"0","org.eclipse.elk.port.side":"WEST"},"width":8.0,"x":-8.0,"y":4.25},{"height":8.0,"id":"P33","layoutOptions":{"org.eclipse.elk.port.index":"1","org.eclipse.elk.port.side":"EAST"},"width":8.0,"x":61.0,"y":16.5},{"height":8.0,"id":"P34","layoutOptions":{"org.eclipse.elk.port.index":"-2","org.eclipse.elk.port.side":"WEST"},"width":8.0,"x":-8.0,"y":16.5},{"height":8.0,"id":"P35","layoutOptions":{"org.eclipse.elk.port.index":"-3","org.eclipse.elk.port.side":"WEST"},"width":8.0,"x":-8.0,"y":28.75}],"width":61.0,"x":215.0,"y":54.375},{"height":25.0,"id":"N15","labels":[{"height":15.0,"id":"L15","text":"Const3","width":42.0,"x":0.0,"y":-20.0}],"layoutOptions":{"org.eclipse.elk.nodeLabels.placement":"[H_LEFT, V_TOP, OUTSIDE]","org.eclipse.elk.portConstraints":"FIXED_ORDER"},"ports":[{"height":8.0,"id":"P36","layoutOptions":{"org.eclipse.elk.port.index":"0","org.eclipse.elk.port.side":"EAST"},"width":8.0,"x":18.0,"y":8.5},{"height":8.0,"id":"P37","layoutOptions":{"org.eclipse.elk.port.index":"-1","org.eclipse.elk.port.side":"WEST"},"width":8.0,"x":-8.0,"y":8.5}],"width":18.0,"x":133.0,"y":32.0},{"height":41.0,"id":"N16","labels":[{"height":15.0,"id":"L16","text":"StringLength","width":74.0,"x":0.0,"y":-20.0}],"layoutOptions":{"org.eclipse.elk.nodeLabels.placement":"[H_LEFT, V_TOP, OUTSIDE]","org.eclipse.elk.portConstraints":"FIXED_ORDER"},"ports":[{"height":8.0,"id":"P38","layoutOptions":{"org.eclipse.elk.port.index":"0","org.eclipse.elk.port.side":"WEST"},"width":8.0,"x":-8.0,"y":16.5},{"height":8.0,"id":"P39","layoutOptions":{"org.eclipse.elk.port.index":"1","org.eclipse.elk.port.side":"EAST"},"width":8.0,"x":61.0,"y":16.5}],"width":61.0,"x":90.0,"y":97.0},{"height":41.0,"id":"N17","labels":[{"height":15.0,"id":"L17","text":"AddSubtract","width":72.0,"x":0.0,"y":-20.0}],"layoutOptions":{"org.eclipse.elk.nodeLabels.placement":"[H_LEFT, V_TOP, OUTSIDE]","org.eclipse.elk.portConstraints":"FIXED_ORDER"},"ports":[{"height":8.0,"id":"P40","layoutOptions":{"org.eclipse.elk.port.index":"0","org.eclipse.elk.port.side":"WEST"},"width":8.0,"x":-8.0,"y":8.333333333333334},{"height":8.0,"id":"P41","layoutOptions":{"org.eclipse.elk.port.index":"-1","org.eclipse.elk.port.side":"WEST"},"width":8.0,"x":-8.0,"y":24.66666666666667},{"height":8.0,"id":"P42","layoutOptions":{"org.eclipse.elk.port.index":"2","org.eclipse.elk.port.side":"EAST"},"width":8.0,"x":41.0,"y":16.5}],"width":41.0,"x":340.0,"y":109.16666666666667},{"height":25.0,"id":"N18","labels":[{"height":15.0,"id":"L18","text":"Const4","width":42.0,"x":0.0,"y":-20.0}],"layoutOptions":{"org.eclipse.elk.nodeLabels.placement":"[H_LEFT, V_TOP, OUTSIDE]","org.eclipse.elk.portConstraints":"FIXED_ORDER"},"ports":[{"height":8.0,"id":"P43","layoutOptions":{"org.eclipse.elk.port.index":"0","org.eclipse.elk.port.side":"EAST"},"width":8.0,"x":62.0,"y":8.5},{"height":8.0,"id":"P44","layoutOptions":{"org.eclipse.elk.port.index":"-1","org.eclipse.elk.port.side":"WEST"},"width":8.0,"x":-8.0,"y":8.5}],"width":62.0,"x":215.0,"y":266.25},{"height":31.0,"id":"N19","labels":[{"height":15.0,"id":"L19","text":"Comparator","width":68.0,"x":0.0,"y":-20.0}],"layoutOptions":{"org.eclipse.elk.nodeLabels.placement":"[H_LEFT, V_TOP, OUTSIDE]","org.eclipse.elk.portConstraints":"FIXED_ORDER"},"ports":[{"height":8.0,"id":"P45","layoutOptions":{"org.eclipse.elk.port.index":"0","org.eclipse.elk.port.side":"WEST"},"width":8.0,"x":-8.0,"y":5.0},{"height":8.0,"id":"P46","layoutOptions":{"org.eclipse.elk.port.index":"-1","org.eclipse.elk.port.side":"WEST"},"width":8.0,"x":-8.0,"y":18.0},{"height":8.0,"id":"P47","layoutOptions":{"org.eclipse.elk.port.index":"2","org.eclipse.elk.port.side":"EAST"},"width":8.0,"x":61.0,"y":11.5}],"width":61.0,"x":341.0,"y":299.75},{"height":31.0,"id":"N20","labels":[{"height":15.0,"id":"L20","text":"LogicalNot","width":61.0,"x":0.0,"y":-20.0}],"layoutOptions":{"org.eclipse.elk.nodeLabels.placement":"[H_LEFT, V_TOP, OUTSIDE]","org.eclipse.elk.portConstraints":"FIXED_ORDER"},"ports":[{"height":8.0,"id":"P48","layoutOptions":{"org.eclipse.elk.port.index":"0","org.eclipse.elk.port.side":"WEST"},"width":8.0,"x":-8.0,"y":11.5},{"height":8.0,"id":"P49","layoutOptions":{"org.eclipse.elk.port.index":"1","org.eclipse.elk.port.side":"EAST"},"width":8.0,"x":31.0,"y":11.5}],"width":31.0,"x":440.0,"y":322.5},{"height":25.0,"id":"N21","labels":[{"height":15.0,"id":"L21","text":"Empty","width":38.0,"x":0.0,"y":-20.0}],"layoutOptions":{"org.eclipse.elk.nodeLabels.placement":"[H_LEFT, V_TOP, OUTSIDE]","org.eclipse.elk.portConstraints":"FIXED_ORDER"},"ports":[{"height":8.0,"id":"P50","layoutOptions":{"org.eclipse.elk.port.index":"0","org.eclipse.elk.port.side":"EAST"},"width":8.0,"x":14.0,"y":8.5},{"height":8.0,"id":"P51","layoutOptions":{"org.eclipse.elk.port.index":"-1","org.eclipse.elk.port.side":"WEST"},"width":8.0,"x":-8.0,"y":8.5}],"width":14.0,"x":367.0,"y":190.16666666666669},{"height":47.0,"id":"N22","labels":[{"height":15.0,"id":"L22","text":"BooleanMultiplexor","width":111.0,"x":0.0,"y":-20.0}],"layoutOptions":{"org.eclipse.elk.nodeLabels.placement":"[H_LEFT, V_TOP, OUTSIDE]","org.eclipse.elk.portConstraints":"FIXED_ORDER"},"ports":[{"height":8.0,"id":"P52","layoutOptions":{"org.eclipse.elk.port.index":"0","org.eclipse.elk.port.side":"WEST"},"width":8.0,"x":-8.0,"y":10.333333333333334},{"height":8.0,"id":"P53","layoutOptions":{"org.eclipse.elk.port.index":"-1","org.eclipse.elk.port.side":"WEST"},"width":8.0,"x":-8.0,"y":28.66666666666667},{"height":8.0,"id":"P54","layoutOptions":{"org.eclipse.elk.port.index":"-2","org.eclipse.elk.port.side":"SOUTH"},"width":8.0,"x":20.5,"y":47.0},{"height":8.0,"id":"P55","layoutOptions":{"org.eclipse.elk.port.index":"3","org.eclipse.elk.port.side":"EAST"},"width":8.0,"x":49.0,"y":19.5}],"width":49.0,"x":440.0,"y":142.66666666666666},{"height":41.0,"id":"N23","labels":[{"height":15.0,"id":"L23","text":"Ramp","width":35.0,"x":0.0,"y":-20.0}],"layoutOptions":{"org.eclipse.elk.nodeLabels.placement":"[H_LEFT, V_TOP, OUTSIDE]","org.eclipse.elk.portConstraints":"FIXED_ORDER"},"ports":[{"height":8.0,"id":"P56","layoutOptions":{"org.eclipse.elk.port.index":"0","org.eclipse.elk.port.side":"EAST"},"width":8.0,"x":61.0,"y":16.5},{"height":8.0,"id":"P57","layoutOptions":{"org.eclipse.elk.port.index":"-1","org.eclipse.elk.port.side":"WEST"},"width":8.0,"x":-8.0,"y":8.333333333333334},{"height":8.0,"id":"P58","layoutOptions":{"org.eclipse.elk.port.index":"-2","org.eclipse.elk.port.side":"WEST"},"width":8.0,"x":-8.0,"y":24.66666666666667}],"width":61.0,"x":215.0,"y":331.25}],"edges":[{"container":"N9","id":"E13","sources":["P19"],"targets":["P24"]},{"container":"N9","id":"E14","sources":["P19"],"targets":["P32"]},{"container":"N9","id":"E15","sources":["P19"],"targets":["P38"]},{"container":"N9","id":"E16","sections":[{"bendPoints":[{"x":322.0,"y":198.5},{"x":322.0,"y":121.5}],"endPoint":{"x":332.0,"y":121.5},"id":"E16_s0","incomingShape":"P23","outgoingShape":"P40","startPoint":{"x":308.0,"y":198.5}}],"sources":["P23"],"targets":["P40"]},{"container":"N9","id":"E17","sections":[{"endPoint":{"x":211.0,"y":198.5},"id":"E17_s0","incomingShape":"P25","outgoingShape":"P22","startPoint":{"x":159.0,"y":198.5}}],"sources":["P25"],"targets":["P22"]},{"container":"N9","id":"E18","sections":[{"bendPoints":[{"x":72.0,"y":172.125},{"x":72.0,"y":198.5}],"endPoint":{"x":82.0,"y":198.5},"id":"E18_s0","incomingShape":"P28","outgoingShape":"P26","startPoint":{"x":46.0,"y":172.125}}],"sources":["P28"],"targets":["P26"]},{"container":"N9","id":"E19","sections":[{"bendPoints":[{"x":72.0,"y":237.125},{"x":72.0,"y":210.75}],"endPoint":{"x":82.0,"y":210.75},"id":"E19_s0","incomingShape":"P30","outgoingShape":"P27","startPoint":{"x":46.0,"y":237.125}}],"sources":["P30"],"targets":["P27"]},{"container":"N9","id":"E20","junctionPoints":[{"x":322.0,"y":121.5}],"sections":[{"bendPoints":[{"x":322.0,"y":74.875},{"x":322.0,"y":121.5}],"endPoint":{"x":332.0,"y":121.5},"id":"E20_s0","incomingShape":"P33","outgoingShape":"P40","startPoint":{"x":284.0,"y":74.875}}],"sources":["P33"],"targets":["P40"]},{"container":"N9","id":"E21","sections":[{"bendPoints":[{"x":197.0,"y":44.5},{"x":197.0,"y":74.875}],"endPoint":{"x":207.0,"y":74.875},"id":"E21_s0","incomingShape":"P36","outgoingShape":"P34","startPoint":{"x":159.0,"y":44.5}}],"sources":["P36"],"targets":["P34"]},{"container":"N9","id":"E22","sections":[{"bendPoints":[{"x":197.0,"y":117.5},{"x":197.0,"y":87.125}],"endPoint":{"x":207.0,"y":87.125},"id":"E22_s0","incomingShape":"P39","outgoingShape":"P35","startPoint":{"x":159.0,"y":117.5}}],"sources":["P39"],"targets":["P35"]},{"container":"N9","id":"E23","sections":[{"bendPoints":[{"x":422.0,"y":129.66666666666669},{"x":422.0,"y":157.0}],"endPoint":{"x":432.0,"y":157.0},"id":"E23_s0","incomingShape":"P42","outgoingShape":"P52","startPoint":{"x":389.0,"y":129.66666666666669}}],"sources":["P42"],"targets":["P52"]},{"container":"N9","id":"E24","sections":[{"bendPoints":[{"x":322.0,"y":278.75},{"x":322.0,"y":308.75}],"endPoint":{"x":333.0,"y":308.75},"id":"E24_s0","incomingShape":"P43","outgoingShape":"P45","startPoint":{"x":285.0,"y":278.75}}],"sources":["P43"],"targets":["P45"]},{"container":"N9","id":"E25","junctionPoints":[{"x":422.0,"y":315.25}],"sections":[{"bendPoints":[{"x":422.0,"y":315.25},{"x":422.0,"y":338.0}],"endPoint":{"x":432.0,"y":338.0},"id":"E25_s0","incomingShape":"P47","outgoingShape":"P48","startPoint":{"x":410.0,"y":315.25}}],"sources":["P47"],"targets":["P48"]},{"container":"N9","id":"E26","sections":[{"bendPoints":[{"x":422.0,"y":315.25},{"x":422.0,"y":292.5},{"x":464.5,"y":292.5}],"endPoint":{"x":464.5,"y":197.66666666666666},"id":"E26_s0","incomingShape":"P47","outgoingShape":"P54","startPoint":{"x":410.0,"y":315.25}}],"sources":["P47"],"targets":["P54"]},{"container":"N9","id":"E27","sources":["P49"],"targets":["P21"]},{"container":"N9","id":"E28","sections":[{"bendPoints":[{"x":422.0,"y":202.66666666666669},{"x":422.0,"y":175.33333333333331}],"endPoint":{"x":432.0,"y":175.33333333333331},"id":"E28_s0","incomingShape":"P50","outgoingShape":"P53","startPoint":{"x":389.0,"y":202.66666666666669}}],"sources":["P50"],"targets":["P53"]},{"container":"N9","id":"E29","sources":["P55"],"targets":["P20"]},{"container":"N9","id":"E30","sections":[{"bendPoints":[{"x":322.0,"y":351.75},{"x":322.0,"y":321.75}],"endPoint":{"x":333.0,"y":321.75},"id":"E30_s0","incomingShape":"P56","outgoingShape":"P46","startPoint":{"x":284.0,"y":351.75}}],"sources":["P56"],"targets":["P46"]}],"height":384.25,"id":"N9","labels":[{"height":15.0,"id":"L9","text":"TrialModule","width":67.0,"x":0.0,"y":-20.0}],"layoutOptions":{"org.eclipse.elk.nodeLabels.placement":"[H_LEFT, V_TOP, OUTSIDE]","org.eclipse.elk.portConstraints":"FREE"},"ports":[{"height":8.0,"id":"P19","layoutOptions":{"org.eclipse.elk.port.index":"0","org.eclipse.elk.port.side":"WEST"},"width":8.0,"x":-8.0,"y":188.125},{"height":8.0,"id":"P20","layoutOptions":{"org.eclipse.elk.port.index":"1","org.eclipse.elk.port.side":"EAST"},"width":8.0,"x":563.0,"y":122.75},{"height":8.0,"id":"P21","layoutOptions":{"org.eclipse.elk.port.index":"2","org.eclipse.elk.port.side":"EAST"},"width":8.0,"x":563.0,"y":253.5}],"width":563.0,"x":116.0,"y":188.66666666666666},{"height":66.0,"id":"N24","labels":[{"height":15.0,"id":"L24","text":"Barrier","width":39.0,"x":0.0,"y":-20.0}],"layoutOptions":{"org.eclipse.elk.nodeLabels.placement":"[H_LEFT, V_TOP, OUTSIDE]","org.eclipse.elk.portConstraints":"FIXED_ORDER"},"ports":[{"height":8.0,"id":"P59","layoutOptions":{"org.eclipse.elk.port.index":"0","org.eclipse.elk.port.side":"WEST"},"width":8.0,"x":-8.0,"y":29.0}],"width":36.0,"x":725.0,"y":190.41666666666666}],"edges":[{"container":"G1","id":"E1","sections":[{"endPoint":{"x":823.0,"y":52.0},"id":"E1_s0","incomingShape":"P3","outgoingShape":"P18","startPoint":{"x":793.0,"y":52.0}}],"sources":["P3"],"targets":["P18"]},{"container":"G1","id":"E2","sections":[{"endPoint":{"x":108.0,"y":380.79166666666663},"id":"E2_s0","incomingShape":"P4","outgoingShape":"P19","startPoint":{"x":66.0,"y":380.79166666666663}}],"sources":["P4"],"targets":["P19"]},{"container":"G1","id":"E3","sections":[{"bendPoints":[{"x":1074.0,"y":92.49999999999999},{"x":1074.0,"y":160.41666666666666},{"x":707.0,"y":160.41666666666666},{"x":707.0,"y":60.0}],"endPoint":{"x":717.0,"y":60.0},"id":"E3_s0","incomingShape":"P10","outgoingShape":"P2","startPoint":{"x":1029.0,"y":92.49999999999999}}],"sources":["P10"],"targets":["P2"]},{"container":"G1","id":"E4","sections":[{"bendPoints":[{"x":962.0,"y":133.0},{"x":962.0,"y":101.66666666666666}],"endPoint":{"x":972.0,"y":101.66666666666666},"id":"E4_s0","incomingShape":"P11","outgoingShape":"P8","startPoint":{"x":908.0,"y":133.0}}],"sources":["P11"],"targets":["P8"]},{"container":"G1","id":"E5","sections":[{"endPoint":{"x":369.0,"y":136.16666666666666},"id":"E5_s0","incomingShape":"P13","outgoingShape":"P15","startPoint":{"x":66.0,"y":136.16666666666666}}],"sources":["P13"],"targets":["P15"]},{"container":"G1","id":"E6","junctionPoints":[{"x":697.0,"y":136.16666666666666}],"sections":[{"bendPoints":[{"x":697.0,"y":136.16666666666666},{"x":697.0,"y":44.0}],"endPoint":{"x":717.0,"y":44.0},"id":"E6_s0","incomingShape":"P16","outgoingShape":"P1","startPoint":{"x":426.0,"y":136.16666666666666}}],"sources":["P16"],"targets":["P1"]},{"container":"G1","id":"E7","junctionPoints":[{"x":697.0,"y":223.41666666666666}],"sections":[{"bendPoints":[{"x":697.0,"y":136.16666666666666},{"x":697.0,"y":223.41666666666666}],"endPoint":{"x":717.0,"y":223.41666666666666},"id":"E7_s0","incomingShape":"P16","outgoingShape":"P59","startPoint":{"x":426.0,"y":136.16666666666666}}],"sources":["P16"],"targets":["P59"]},{"container":"G1","id":"E8","sections":[{"bendPoints":[{"x":962.0,"y":52.0},{"x":962.0,"y":83.33333333333331}],"endPoint":{"x":972.0,"y":83.33333333333331},"id":"E8_s0","incomingShape":"P17","outgoingShape":"P7","startPoint":{"x":942.0,"y":52.0}}],"sources":["P17"],"targets":["P7"]},{"container":"G1","id":"E9","sections":[{"bendPoints":[{"x":952.0,"y":52.0},{"x":952.0,"y":80.5},{"x":813.0,"y":80.5},{"x":813.0,"y":52.0}],"endPoint":{"x":823.0,"y":52.0},"id":"E9_s0","incomingShape":"P17","outgoingShape":"P18","startPoint":{"x":942.0,"y":52.0}}],"sources":["P17"],"targets":["P18"]},{"container":"G1","id":"E10","junctionPoints":[{"x":697.0,"y":315.41666666666663}],"sections":[{"bendPoints":[{"x":697.0,"y":315.41666666666663},{"x":697.0,"y":357.29166666666663}],"endPoint":{"x":717.0,"y":357.29166666666663},"id":"E10_s0","incomingShape":"P20","outgoingShape":"P6","startPoint":{"x":687.0,"y":315.41666666666663}}],"sources":["P20"],"targets":["P6"]},{"container":"G1","id":"E11","sections":[{"bendPoints":[{"x":697.0,"y":315.41666666666663},{"x":697.0,"y":223.41666666666666}],"endPoint":{"x":717.0,"y":223.41666666666666},"id":"E11_s0","incomingShape":"P20","outgoingShape":"P59","startPoint":{"x":687.0,"y":315.41666666666663}}],"sources":["P20"],"targets":["P59"]},{"container":"G1","id":"E12","sections":[{"bendPoints":[{"x":1000.5,"y":446.16666666666663}],"endPoint":{"x":1000.5,"y":123.99999999999999},"id":"E12_s0","incomingShape":"P21","outgoingShape":"P9","startPoint":{"x":687.0,"y":446.16666666666663}}],"sources":["P21"],"targets":["P9"]}],"height":584.9166666666666,"id":"G1","layoutOptions":{"org.eclipse.elk.portConstraints":"FREE","org.eclipse.elk.randomSeed":"1"},"width":1086.0,"x":0.0,"y":0.0}

perf/model_parity_tickets/report.md

## Drift Samples

- `tickets/core/056_portLabelPlacement.elkt`: diffs=2 [coordinate=2], first: children[0]/ports[0]/y: number mismatch (55.0 != 35.0)
- `tickets/core/299_surroundingPortSpace.elkt`: diffs=1 [coordinate=1], first: children[0]/height: number mismatch (40.0 != 20.0)
- `tickets/core/491_portSpacing.elkt`: diffs=4 [coordinate=2, section=2], first: children[0]/ports[1]/y: number mismatch (37.0 != 38.0)
- `tickets/core/562_insideSelfLoopAlgorithmResolving.elkt`: diffs=6 [coordinate=3, section=3], first: children[0]/ports[0]/y: number mismatch (12.0 != 0.0)
- `tickets/layered/079_selfLoopLabels.elkt`: diffs=1 [ordering=1], first: edges[0]/sections[0]/bendPoints: array length mismatch (4 != 2)
- `tickets/layered/082_unfortunateEdgeLabelSideSelection.elkt`: diffs=20 [section=14, label=4, coordinate=2], first: children[1]/x: number mismatch (15.0 != 12.0)
- `tickets/layered/128_selfLoopLabelSpacing_complex.elkt`: diffs=20 [section=10, label=7, coordinate=3], first: children[0]/y: number mismatch (192.0 != 120.0)
- `tickets/layered/128_selfLoopLabelSpacing_simple.elkt`: diffs=7 [section=4, coordinate=1, label=1, other=1], first: children[0]/y: number mismatch (52.0 != 34.0)
- `tickets/layered/167_insidePortLabelsInHierarchicalGraphs.elkt`: diffs=4 [coordinate=2, section=1, other=1], first: children[1]/edges[1]/sections[0]/endPoint/x: number mismatch (4.0 != 24.0)
- `tickets/layered/193_hierarchicalPortOverlaps.elkt`: diffs=7 [coordinate=4, structure=1, section=1, other=1], first: children[0]/edges[0]/sections[0]: missing keys on right: bendPoints
- `tickets/layered/194_excessiveWhiteSpace.elkt`: diffs=20 [section=9, coordinate=8, ordering=2, structure=1], first: children[0]/children[0]/y: number mismatch (153.0 != 72.0)
- `tickets/layered/213_componentsCompaction.elkt`: diffs=20 [coordinate=20], first: children[0]/children[0]/x: number mismatch (12.5 != 12.0)
- `tickets/layered/273_insideSelfLoopsWithLabels.elkt`: diffs=15 [coordinate=7, section=4, label=2, other=2], first: children[0]/children[0]/ports[0]/x: number mismatch (0.0 != -20.0)
- `tickets/layered/288_selfLoopsCauseNPE_a.elkt`: diffs=17 [section=9, coordinate=5, other=2, ordering=1], first: children[0]/y: number mismatch (24.0 != 49.0)
- `tickets/layered/288_selfLoopsCauseNPE_b.elkt`: diffs=20 [section=11, coordinate=7, ordering=1, structure=1], first: children[0]/children[0]/children[0]/y: number mismatch (22.0 != 32.0)
- `tickets/layered/297_sameSideInsideSelfLoop.elkt`: diffs=11 [coordinate=4, section=4, other=2, structure=1], first: children[0]/height: number mismatch (74.0 != 100.0)
- `tickets/layered/298_selfLoopsCauseAIOOBE.elkt`: diffs=14 [coordinate=7, section=4, other=2, structure=1], first: children[0]/height: number mismatch (44.0 != 100.0)
- `tickets/layered/302_brokenSplineSelfLoops.elkt`: diffs=6 [section=2, other=2, coordinate=1, ordering=1], first: children[0]/x: number mismatch (23.333333333333332 != 27.0)
- `tickets/layered/304_wrongMinimumNodeSize.elkt`: diffs=20 [coordinate=10, section=8, structure=2], first: children[0]/y: number mismatch (47.0 != 12.0)
- `tickets/layered/308_hyperedgeMerging.elkt`: diffs=17 [section=12, coordinate=2, structure=1, ordering=1, other=1], first: children[1]/y: number mismatch (23.0 != 33.0)