perf/model_parity/java/layout/realworld/ptolemy/flattened/backtrack_trialmodule_TrialModuleNonBacktrack.elkt.json

{"id":"G1","children":[{"id":"N1","labels":[{"text":"Backtrack","id":"L1","x":0.0,"y":-20.0,"width":59.0,"height":15.0}],"ports":[{"id":"P1","layoutOptions":{"org.eclipse.elk.port.side":"WEST","org.eclipse.elk.port.index":"0"},"x":-8.0,"y":8.0,"width":8.0,"height":8.0},{"id":"P2","layoutOptions":{"org.eclipse.elk.port.side":"WEST","org.eclipse.elk.port.index":"-1"},"x":-8.0,"y":24.0,"width":8.0,"height":8.0},{"id":"P3","layoutOptions":{"org.eclipse.elk.port.side":"EAST","org.eclipse.elk.port.index":"2"},"x":60.0,"y":16.0,"width":8.0,"height":8.0}],"layoutOptions":{"org.eclipse.elk.portConstraints":"FIXED_ORDER","org.eclipse.elk.nodeLabels.placement":"[H_LEFT, V_TOP, OUTSIDE]"},"x":376.0,"y":42.0,"width":60.0,"height":40.0},{"id":"N2","labels":[{"text":"StringConst","id":"L2","x":0.0,"y":-20.0,"width":68.0,"height":15.0}],"ports":[{"id":"P4","layoutOptions":{"org.eclipse.elk.port.side":"EAST","org.eclipse.elk.port.index":"0"},"x":38.0,"y":8.5,"width":8.0,"height":8.0},{"id":"P5","layoutOptions":{"org.eclipse.elk.port.side":"WEST","org.eclipse.elk.port.index":"-1"},"x":-8.0,"y":8.5,"width":8.0,"height":8.0}],"layoutOptions":{"org.eclipse.elk.portConstraints":"FIXED_ORDER","org.eclipse.elk.nodeLabels.placement":"[H_LEFT, V_TOP, OUTSIDE]"},"x":20.0,"y":64.0,"width":38.0,"height":25.0},{"id":"N3","labels":[{"text":"Display","id":"L3","x":0.0,"y":-20.0,"width":43.0,"height":15.0}],"ports":[{"id":"P6","layoutOptions":{"org.eclipse.elk.port.side":"WEST","org.eclipse.elk.port.index":"0"},"x":-8.0,"y":11.5,"width":8.0,"height":8.0}],"layoutOptions":{"org.eclipse.elk.portConstraints":"FIXED_ORDER","org.eclipse.elk.nodeLabels.placement":"[H_LEFT, V_TOP, OUTSIDE]"},"x":645.0,"y":469.8333333333333,"width":41.0,"height":31.0},{"id":"N4","labels":[{"text":"BooleanSelect","id":"L4","x":0.0,"y":-20.0,"width":84.0,"height":15.0}],"ports":[{"id":"P7","layoutOptions":{"org.eclipse.elk.port.side":"WEST","org.eclipse.elk.port.index":"0"},"x":-8.0,"y":10.333333333333334,"width":8.0,"height":8.0},{"id":"P8","layoutOptions":{"org.eclipse.elk.port.side":"WEST","org.eclipse.elk.port.index":"-1"},"x":-8.0,"y":28.66666666666667,"width":8.0,"height":8.0},{"id":"P9","layoutOptions":{"org.eclipse.elk.port.side":"SOUTH","org.eclipse.elk.port.index":"-2"},"x":16.5,"y":47.0,"width":8.0,"height":8.0},{"id":"P10","layoutOptions":{"org.eclipse.elk.port.side":"EAST","org.eclipse.elk.port.index":"3"},"x":41.0,"y":19.5,"width":8.0,"height":8.0}],"layoutOptions":{"org.eclipse.elk.portConstraints":"FIXED_ORDER","org.eclipse.elk.nodeLabels.placement":"[H_LEFT, V_TOP, OUTSIDE]"},"x":645.0,"y":47.666666666666664,"width":41.0,"height":47.0},{"id":"N5","labels":[{"text":"Not Rollback","id":"L5","x":0.0,"y":-20.0,"width":74.0,"height":15.0}],"ports":[{"id":"P11","layoutOptions":{"org.eclipse.elk.port.side":"EAST","org.eclipse.elk.port.index":"0"},"x":22.0,"y":8.5,"width":8.0,"height":8.0},{"id":"P12","layoutOptions":{"org.eclipse.elk.port.side":"WEST","org.eclipse.elk.port.index":"-1"},"x":-8.0,"y":8.5,"width":8.0,"height":8.0}],"layoutOptions":{"org.eclipse.elk.portConstraints":"FIXED_ORDER","org.eclipse.elk.nodeLabels.placement":"[H_LEFT, V_TOP, OUTSIDE]"},"x":533.0,"y":130.5,"width":22.0,"height":25.0},{"id":"N6","labels":[{"text":"Const","id":"L6","x":0.0,"y":-20.0,"width":34.0,"height":15.0}],"ports":[{"id":"P13","layoutOptions":{"org.eclipse.elk.port.side":"EAST","org.eclipse.elk.port.index":"0"},"x":38.0,"y":8.5,"width":8.0,"height":8.0},{"id":"P14","layoutOptions":{"org.eclipse.elk.port.side":"WEST","org.eclipse.elk.port.index":"-1"},"x":-8.0,"y":8.5,"width":8.0,"height":8.0}],"layoutOptions":{"org.eclipse.elk.portConstraints":"FIXED_ORDER","org.eclipse.elk.nodeLabels.placement":"[H_LEFT, V_TOP, OUTSIDE]"},"x":139.0,"y":41.5,"width":38.0,"height":25.0},{"id":"N7","labels":[{"text":"SampleDelay","id":"L7","x":0.0,"y":-20.0,"width":77.0,"height":15.0}],"ports":[{"id":"P15","layoutOptions":{"org.eclipse.elk.port.side":"WEST","org.eclipse.elk.port.index":"0"},"x":-8.0,"y":8.5,"width":8.0,"height":8.0},{"id":"P16","layoutOptions":{"org.eclipse.elk.port.side":"EAST","org.eclipse.elk.port.index":"1"},"x":41.0,"y":8.5,"width":8.0,"height":8.0}],"layoutOptions":{"org.eclipse.elk.portConstraints":"FIXED_ORDER","org.eclipse.elk.nodeLabels.placement":"[H_LEFT, V_TOP, OUTSIDE]"},"x":261.0,"y":41.5,"width":41.0,"height":25.0},{"id":"N8","labels":[{"text":"ResourcePool","id":"L8","x":0.0,"y":-20.0,"width":81.0,"height":15.0}],"ports":[{"id":"P17","layoutOptions":{"org.eclipse.elk.port.side":"EAST","org.eclipse.elk.port.index":"0"},"x":103.0,"y":14.5,"width":8.0,"height":8.0},{"id":"P18","layoutOptions":{"org.eclipse.elk.port.side":"WEST","org.eclipse.elk.port.index":"-1"},"x":-8.0,"y":14.5,"width":8.0,"height":8.0}],"layoutOptions":{"org.eclipse.elk.portConstraints":"FIXED_ORDER","org.eclipse.elk.nodeLabels.placement":"[H_LEFT, V_TOP, OUTSIDE]"},"x":496.0,"y":43.5,"width":103.0,"height":37.0},{"id":"N9","labels":[{"text":"Barrier","id":"L9","x":0.0,"y":-20.0,"width":39.0,"height":15.0}],"ports":[{"id":"P19","layoutOptions":{"org.eclipse.elk.port.side":"WEST","org.eclipse.elk.port.index":"0"},"x":-8.0,"y":29.0,"width":8.0,"height":8.0}],"layoutOptions":{"org.eclipse.elk.portConstraints":"FIXED_ORDER","org.eclipse.elk.nodeLabels.placement":"[H_LEFT, V_TOP, OUTSIDE]"},"x":645.0,"y":241.0,"width":36.0,"height":66.0},{"id":"N10","labels":[{"text":"StringFunction","id":"L10","x":0.0,"y":-20.0,"width":85.0,"height":15.0}],"ports":[{"id":"P20","layoutOptions":{"org.eclipse.elk.port.side":"WEST","org.eclipse.elk.port.index":"0"},"x":-8.0,"y":11.5,"width":8.0,"height":8.0},{"id":"P21","layoutOptions":{"org.eclipse.elk.port.side":"EAST","org.eclipse.elk.port.index":"1"},"x":81.0,"y":11.5,"width":8.0,"height":8.0}],"layoutOptions":{"org.eclipse.elk.portConstraints":"FIXED_ORDER","org.eclipse.elk.nodeLabels.placement":"[H_LEFT, V_TOP, OUTSIDE]"},"x":245.0,"y":606.5,"width":81.0,"height":31.0},{"id":"N11","labels":[{"text":"StringSubstring1","id":"L11","x":0.0,"y":-20.0,"width":97.0,"height":15.0}],"ports":[{"id":"P22","layoutOptions":{"org.eclipse.elk.port.side":"WEST","org.eclipse.elk.port.index":"0"},"x":-8.0,"y":4.25,"width":8.0,"height":8.0},{"id":"P23","layoutOptions":{"org.eclipse.elk.port.side":"EAST","org.eclipse.elk.port.index":"1"},"x":61.0,"y":16.5,"width":8.0,"height":8.0},{"id":"P24","layoutOptions":{"org.eclipse.elk.port.side":"WEST","org.eclipse.elk.port.index":"-2"},"x":-8.0,"y":16.5,"width":8.0,"height":8.0},{"id":"P25","layoutOptions":{"org.eclipse.elk.port.side":"WEST","org.eclipse.elk.port.index":"-3"},"x":-8.0,"y":28.75,"width":8.0,"height":8.0}],"layoutOptions":{"org.eclipse.elk.portConstraints":"FIXED_ORDER","org.eclipse.elk.nodeLabels.placement":"[H_LEFT, V_TOP, OUTSIDE]"},"x":116.0,"y":601.5,"width":61.0,"height":41.0},{"id":"N12","labels":[{"text":"Const1","id":"L12","x":0.0,"y":-20.0,"width":42.0,"height":15.0}],"ports":[{"id":"P26","layoutOptions":{"org.eclipse.elk.port.side":"EAST","org.eclipse.elk.port.index":"0"},"x":18.0,"y":8.5,"width":8.0,"height":8.0},{"id":"P27","layoutOptions":{"org.eclipse.elk.port.side":"WEST","org.eclipse.elk.port.index":"-1"},"x":-8.0,"y":8.5,"width":8.0,"height":8.0}],"layoutOptions":{"org.eclipse.elk.portConstraints":"FIXED_ORDER","org.eclipse.elk.nodeLabels.placement":"[H_LEFT, V_TOP, OUTSIDE]"},"x":40.0,"y":609.5,"width":18.0,"height":25.0},{"id":"N13","labels":[{"text":"Const2","id":"L13","x":0.0,"y":-20.0,"width":42.0,"height":15.0}],"ports":[{"id":"P28","layoutOptions":{"org.eclipse.elk.port.side":"EAST","org.eclipse.elk.port.index":"0"},"x":18.0,"y":8.5,"width":8.0,"height":8.0},{"id":"P29","layoutOptions":{"org.eclipse.elk.port.side":"WEST","org.eclipse.elk.port.index":"-1"},"x":-8.0,"y":8.5,"width":8.0,"height":8.0}],"layoutOptions":{"org.eclipse.elk.portConstraints":"FIXED_ORDER","org.eclipse.elk.nodeLabels.placement":"[H_LEFT, V_TOP, OUTSIDE]"},"x":40.0,"y":674.5,"width":18.0,"height":25.0},{"id":"N14","labels":[{"text":"StringSubstring2","id":"L14","x":0.0,"y":-20.0,"width":97.0,"height":15.0}],"ports":[{"id":"P30","layoutOptions":{"org.eclipse.elk.port.side":"WEST","org.eclipse.elk.port.index":"0"},"x":-8.0,"y":4.25,"width":8.0,"height":8.0},{"id":"P31","layoutOptions":{"org.eclipse.elk.port.side":"EAST","org.eclipse.elk.port.index":"1"},"x":61.0,"y":16.5,"width":8.0,"height":8.0},{"id":"P32","layoutOptions":{"org.eclipse.elk.port.side":"WEST","org.eclipse.elk.port.index":"-2"},"x":-8.0,"y":16.5,"width":8.0,"height":8.0},{"id":"P33","layoutOptions":{"org.eclipse.elk.port.side":"WEST","org.eclipse.elk.port.index":"-3"},"x":-8.0,"y":28.75,"width":8.0,"height":8.0}],"layoutOptions":{"org.eclipse.elk.portConstraints":"FIXED_ORDER","org.eclipse.elk.nodeLabels.placement":"[H_LEFT, V_TOP, OUTSIDE]"},"x":241.0,"y":447.5,"width":61.0,"height":41.0},{"id":"N15","labels":[{"text":"Const3","id":"L15","x":0.0,"y":-20.0,"width":42.0,"height":15.0}],"ports":[{"id":"P34","layoutOptions":{"org.eclipse.elk.port.side":"EAST","org.eclipse.elk.port.index":"0"},"x":18.0,"y":8.5,"width":8.0,"height":8.0},{"id":"P35","layoutOptions":{"org.eclipse.elk.port.side":"WEST","org.eclipse.elk.port.index":"-1"},"x":-8.0,"y":8.5,"width":8.0,"height":8.0}],"layoutOptions":{"org.eclipse.elk.portConstraints":"FIXED_ORDER","org.eclipse.elk.nodeLabels.placement":"[H_LEFT, V_TOP, OUTSIDE]"},"x":159.0,"y":455.5,"width":18.0,"height":25.0},{"id":"N16","labels":[{"text":"StringLength","id":"L16","x":0.0,"y":-20.0,"width":74.0,"height":15.0}],"ports":[{"id":"P36","layoutOptions":{"org.eclipse.elk.port.side":"WEST","org.eclipse.elk.port.index":"0"},"x":-8.0,"y":16.5,"width":8.0,"height":8.0},{"id":"P37","layoutOptions":{"org.eclipse.elk.port.side":"EAST","org.eclipse.elk.port.index":"1"},"x":61.0,"y":16.5,"width":8.0,"height":8.0}],"layoutOptions":{"org.eclipse.elk.portConstraints":"FIXED_ORDER","org.eclipse.elk.nodeLabels.placement":"[H_LEFT, V_TOP, OUTSIDE]"},"x":130.0,"y":520.5,"width":61.0,"height":41.0},{"id":"N17","labels":[{"text":"AddSubtract","id":"L17","x":0.0,"y":-20.0,"width":72.0,"height":15.0}],"ports":[{"id":"P38","layoutOptions":{"org.eclipse.elk.port.side":"WEST","org.eclipse.elk.port.index":"0"},"x":-8.0,"y":8.333333333333334,"width":8.0,"height":8.0},{"id":"P39","layoutOptions":{"org.eclipse.elk.port.side":"WEST","org.eclipse.elk.port.index":"-1"},"x":-8.0,"y":24.66666666666667,"width":8.0,"height":8.0},{"id":"P40","layoutOptions":{"org.eclipse.elk.port.side":"EAST","org.eclipse.elk.port.index":"2"},"x":41.0,"y":16.5,"width":8.0,"height":8.0}],"layoutOptions":{"org.eclipse.elk.portConstraints":"FIXED_ORDER","org.eclipse.elk.nodeLabels.placement":"[H_LEFT, V_TOP, OUTSIDE]"},"x":376.0,"y":455.6666666666667,"width":41.0,"height":41.0},{"id":"N18","labels":[{"text":"Const4","id":"L18","x":0.0,"y":-20.0,"width":42.0,"height":15.0}],"ports":[{"id":"P41","layoutOptions":{"org.eclipse.elk.port.side":"EAST","org.eclipse.elk.port.index":"0"},"x":62.0,"y":8.5,"width":8.0,"height":8.0},{"id":"P42","layoutOptions":{"org.eclipse.elk.port.side":"WEST","org.eclipse.elk.port.index":"-1"},"x":-8.0,"y":8.5,"width":8.0,"height":8.0}],"layoutOptions":{"org.eclipse.elk.portConstraints":"FIXED_ORDER","org.eclipse.elk.nodeLabels.placement":"[H_LEFT, V_TOP, OUTSIDE]"},"x":241.0,"y":301.5,"width":62.0,"height":25.0},{"id":"N19","labels":[{"text":"Comparator","id":"L19","x":0.0,"y":-20.0,"width":68.0,"height":15.0}],"ports":[{"id":"P43","layoutOptions":{"org.eclipse.elk.port.side":"WEST","org.eclipse.elk.port.index":"0"},"x":-8.0,"y":5.0,"width":8.0,"height":8.0},{"id":"P44","layoutOptions":{"org.eclipse.elk.port.side":"WEST","org.eclipse.elk.port.index":"-1"},"x":-8.0,"y":18.0,"width":8.0,"height":8.0},{"id":"P45","layoutOptions":{"org.eclipse.elk.port.side":"EAST","org.eclipse.elk.port.index":"2"},"x":61.0,"y":11.5,"width":8.0,"height":8.0}],"layoutOptions":{"org.eclipse.elk.portConstraints":"FIXED_ORDER","org.eclipse.elk.nodeLabels.placement":"[H_LEFT, V_TOP, OUTSIDE]"},"x":377.0,"y":305.0,"width":61.0,"height":31.0},{"id":"N20","labels":[{"text":"LogicalNot","id":"L20","x":0.0,"y":-20.0,"width":61.0,"height":15.0}],"ports":[{"id":"P46","layoutOptions":{"org.eclipse.elk.port.side":"WEST","org.eclipse.elk.port.index":"0"},"x":-8.0,"y":11.5,"width":8.0,"height":8.0},{"id":"P47","layoutOptions":{"org.eclipse.elk.port.side":"EAST","org.eclipse.elk.port.index":"1"},"x":31.0,"y":11.5,"width":8.0,"height":8.0}],"layoutOptions":{"org.eclipse.elk.portConstraints":"FIXED_ORDER","org.eclipse.elk.nodeLabels.placement":"[H_LEFT, V_TOP, OUTSIDE]"},"x":532.0,"y":195.5,"width":31.0,"height":31.0},{"id":"N21","labels":[{"text":"Empty","id":"L21","x":0.0,"y":-20.0,"width":38.0,"height":15.0}],"ports":[{"id":"P48","layoutOptions":{"org.eclipse.elk.port.side":"EAST","org.eclipse.elk.port.index":"0"},"x":14.0,"y":8.5,"width":8.0,"height":8.0},{"id":"P49","layoutOptions":{"org.eclipse.elk.port.side":"WEST","org.eclipse.elk.port.index":"-1"},"x":-8.0,"y":8.5,"width":8.0,"height":8.0}],"layoutOptions":{"org.eclipse.elk.portConstraints":"FIXED_ORDER","org.eclipse.elk.nodeLabels.placement":"[H_LEFT, V_TOP, OUTSIDE]"},"x":403.0,"y":536.6666666666667,"width":14.0,"height":25.0},{"id":"N22","labels":[{"text":"BooleanMultiplexor","id":"L22","x":0.0,"y":-20.0,"width":111.0,"height":15.0}],"ports":[{"id":"P50","layoutOptions":{"org.eclipse.elk.port.side":"WEST","org.eclipse.elk.port.index":"0"},"x":-8.0,"y":10.333333333333334,"width":8.0,"height":8.0},{"id":"P51","layoutOptions":{"org.eclipse.elk.port.side":"WEST","org.eclipse.elk.port.index":"-1"},"x":-8.0,"y":28.66666666666667,"width":8.0,"height":8.0},{"id":"P52","layoutOptions":{"org.eclipse.elk.port.side":"SOUTH","org.eclipse.elk.port.index":"-2"},"x":20.5,"y":47.0,"width":8.0,"height":8.0},{"id":"P53","layoutOptions":{"org.eclipse.elk.port.side":"EAST","org.eclipse.elk.port.index":"3"},"x":49.0,"y":19.5,"width":8.0,"height":8.0}],"layoutOptions":{"org.eclipse.elk.portConstraints":"FIXED_ORDER","org.eclipse.elk.nodeLabels.placement":"[H_LEFT, V_TOP, OUTSIDE]"},"x":506.0,"y":461.8333333333333,"width":49.0,"height":47.0},{"id":"N23","labels":[{"text":"Ramp","id":"L23","x":0.0,"y":-20.0,"width":35.0,"height":15.0}],"ports":[{"id":"P54","layoutOptions":{"org.eclipse.elk.port.side":"EAST","org.eclipse.elk.port.index":"0"},"x":61.0,"y":16.5,"width":8.0,"height":8.0},{"id":"P55","layoutOptions":{"org.eclipse.elk.port.side":"WEST","org.eclipse.elk.port.index":"-1"},"x":-8.0,"y":8.333333333333334,"width":8.0,"height":8.0},{"id":"P56","layoutOptions":{"org.eclipse.elk.port.side":"WEST","org.eclipse.elk.port.index":"-2"},"x":-8.0,"y":24.66666666666667,"width":8.0,"height":8.0}],"layoutOptions":{"org.eclipse.elk.portConstraints":"FIXED_ORDER","org.eclipse.elk.nodeLabels.placement":"[H_LEFT, V_TOP, OUTSIDE]"},"x":241.0,"y":366.5,"width":61.0,"height":41.0}],"layoutOptions":{"org.eclipse.elk.portConstraints":"FREE","org.eclipse.elk.randomSeed":"1"},"x":0.0,"y":0.0,"width":751.0,"height":711.5,"edges":[{"id":"E1","sources":["P3"],"targets":["P18"],"sections":[{"id":"E1_s0","startPoint":{"x":444.0,"y":62.0},"endPoint":{"x":488.0,"y":62.0},"incomingShape":"P3","outgoingShape":"P18"}],"container":"G1"},{"id":"E2","sources":["P4"],"targets":["P22"],"sections":[{"id":"E2_s0","startPoint":{"x":66.0,"y":76.5},"endPoint":{"x":108.0,"y":609.75},"bendPoints":[{"x":98.0,"y":76.5},{"x":98.0,"y":609.75}],"incomingShape":"P4","outgoingShape":"P22"}],"junctionPoints":[{"x":98.0,"y":76.5}],"container":"G1"},{"id":"E3","sources":["P4"],"targets":["P30"],"sections":[{"id":"E3_s0","startPoint":{"x":66.0,"y":76.5},"endPoint":{"x":233.0,"y":455.75},"bendPoints":[{"x":223.0,"y":76.5},{"x":223.0,"y":455.75}],"incomingShape":"P4","outgoingShape":"P30"}],"container":"G1"},{"id":"E4","sources":["P4"],"targets":["P36"],"sections":[{"id":"E4_s0","startPoint":{"x":66.0,"y":76.5},"endPoint":{"x":122.0,"y":541.0},"bendPoints":[{"x":98.0,"y":76.5},{"x":98.0,"y":541.0}],"incomingShape":"P4","outgoingShape":"P36"}],"junctionPoints":[{"x":98.0,"y":541.0}],"container":"G1"},{"id":"E5","sources":["P10"],"targets":["P2"],"sections":[{"id":"E5_s0","startPoint":{"x":694.0,"y":71.16666666666666},"endPoint":{"x":368.0,"y":70.0},"bendPoints":[{"x":739.0,"y":71.16666666666666},{"x":739.0,"y":12.0},{"x":358.0,"y":12.0},{"x":358.0,"y":70.0}],"incomingShape":"P10","outgoingShape":"P2"}],"container":"G1"},{"id":"E6","sources":["P11"],"targets":["P8"],"sections":[{"id":"E6_s0","startPoint":{"x":563.0,"y":143.0},"endPoint":{"x":637.0,"y":80.33333333333334},"bendPoints":[{"x":627.0,"y":143.0},{"x":627.0,"y":80.33333333333334}],"incomingShape":"P11","outgoingShape":"P8"}],"container":"G1"},{"id":"E7","sources":["P13"],"targets":["P15"],"sections":[{"id":"E7_s0","startPoint":{"x":185.0,"y":54.0},"endPoint":{"x":253.0,"y":54.0},"incomingShape":"P13","outgoingShape":"P15"}],"container":"G1"},{"id":"E8","sources":["P16"],"targets":["P1"],"sections":[{"id":"E8_s0","startPoint":{"x":310.0,"y":54.0},"endPoint":{"x":368.0,"y":54.0},"incomingShape":"P16","outgoingShape":"P1"}],"container":"G1"},{"id":"E9","sources":["P16"],"targets":["P19"],"sections":[{"id":"E9_s0","startPoint":{"x":310.0,"y":54.0},"endPoint":{"x":637.0,"y":274.0},"bendPoints":[{"x":348.0,"y":54.0},{"x":348.0,"y":274.0}],"incomingShape":"P16","outgoingShape":"P19"}],"junctionPoints":[{"x":348.0,"y":54.0}],"container":"G1"},{"id":"E10","sources":["P17"],"targets":["P7"],"sections":[{"id":"E10_s0","startPoint":{"x":607.0,"y":62.0},"endPoint":{"x":637.0,"y":62.0},"incomingShape":"P17","outgoingShape":"P7"}],"container":"G1"},{"id":"E11","sources":["P17"],"targets":["P18"],"sections":[{"id":"E11_s0","startPoint":{"x":607.0,"y":62.0},"endPoint":{"x":488.0,"y":62.0},"bendPoints":[{"x":617.0,"y":62.0},{"x":617.0,"y":90.5},{"x":478.0,"y":90.5},{"x":478.0,"y":62.0}],"incomingShape":"P17","outgoingShape":"P18"}],"container":"G1"},{"id":"E12","sources":["P21"],"targets":["P38"],"sections":[{"id":"E12_s0","startPoint":{"x":334.0,"y":622.0},"endPoint":{"x":368.0,"y":468.0},"bendPoints":[{"x":348.0,"y":622.0},{"x":348.0,"y":468.0}],"incomingShape":"P21","outgoingShape":"P38"}],"junctionPoints":[{"x":348.0,"y":468.0}],"container":"G1"},{"id":"E13","sources":["P23"],"targets":["P20"],"sections":[{"id":"E13_s0","startPoint":{"x":185.0,"y":622.0},"endPoint":{"x":237.0,"y":622.0},"incomingShape":"P23","outgoingShape":"P20"}],"container":"G1"},{"id":"E14","sources":["P26"],"targets":["P24"],"sections":[{"id":"E14_s0","startPoint":{"x":66.0,"y":622.0},"endPoint":{"x":108.0,"y":622.0},"incomingShape":"P26","outgoingShape":"P24"}],"container":"G1"},{"id":"E15","sources":["P28"],"targets":["P25"],"sections":[{"id":"E15_s0","startPoint":{"x":66.0,"y":687.0},"endPoint":{"x":108.0,"y":634.25},"bendPoints":[{"x":98.0,"y":687.0},{"x":98.0,"y":634.25}],"incomingShape":"P28","outgoingShape":"P25"}],"container":"G1"},{"id":"E16","sources":["P31"],"targets":["P38"],"sections":[{"id":"E16_s0","startPoint":{"x":310.0,"y":468.0},"endPoint":{"x":368.0,"y":468.0},"incomingShape":"P31","outgoingShape":"P38"}],"container":"G1"},{"id":"E17","sources":["P34"],"targets":["P32"],"sections":[{"id":"E17_s0","startPoint":{"x":185.0,"y":468.0},"endPoint":{"x":233.0,"y":468.0},"incomingShape":"P34","outgoingShape":"P32"}],"container":"G1"},{"id":"E18","sources":["P37"],"targets":["P33"],"sections":[{"id":"E18_s0","startPoint":{"x":199.0,"y":541.0},"endPoint":{"x":233.0,"y":480.25},"bendPoints":[{"x":223.0,"y":541.0},{"x":223.0,"y":480.25}],"incomingShape":"P37","outgoingShape":"P33"}],"container":"G1"},{"id":"E19","sources":["P40"],"targets":["P50"],"sections":[{"id":"E19_s0","startPoint":{"x":425.0,"y":476.1666666666667},"endPoint":{"x":498.0,"y":476.16666666666663},"incomingShape":"P40","outgoingShape":"P50"}],"container":"G1"},{"id":"E20","sources":["P41"],"targets":["P43"],"sections":[{"id":"E20_s0","startPoint":{"x":311.0,"y":314.0},"endPoint":{"x":369.0,"y":314.0},"incomingShape":"P41","outgoingShape":"P43"}],"container":"G1"},{"id":"E21","sources":["P45"],"targets":["P46"],"sections":[{"id":"E21_s0","startPoint":{"x":446.0,"y":320.5},"endPoint":{"x":524.0,"y":211.0},"bendPoints":[{"x":468.0,"y":320.5},{"x":468.0,"y":211.0}],"incomingShape":"P45","outgoingShape":"P46"}],"junctionPoints":[{"x":468.0,"y":320.5}],"container":"G1"},{"id":"E22","sources":["P45"],"targets":["P52"],"sections":[{"id":"E22_s0","startPoint":{"x":446.0,"y":320.5},"endPoint":{"x":530.5,"y":516.8333333333333},"bendPoints":[{"x":468.0,"y":320.5},{"x":468.0,"y":526.8333333333333},{"x":530.5,"y":526.8333333333333}],"incomingShape":"P45","outgoingShape":"P52"}],"container":"G1"},{"id":"E23","sources":["P47"],"targets":["P9"],"sections":[{"id":"E23_s0","startPoint":{"x":571.0,"y":211.0},"endPoint":{"x":665.5,"y":102.66666666666666},"bendPoints":[{"x":665.5,"y":211.0}],"incomingShape":"P47","outgoingShape":"P9"}],"container":"G1"},{"id":"E24","sources":["P48"],"targets":["P51"],"sections":[{"id":"E24_s0","startPoint":{"x":425.0,"y":549.1666666666667},"endPoint":{"x":498.0,"y":494.5},"bendPoints":[{"x":458.0,"y":549.1666666666667},{"x":458.0,"y":494.5}],"incomingShape":"P48","outgoingShape":"P51"}],"container":"G1"},{"id":"E25","sources":["P53"],"targets":["P6"],"sections":[{"id":"E25_s0","startPoint":{"x":563.0,"y":485.3333333333333},"endPoint":{"x":637.0,"y":485.3333333333333},"incomingShape":"P53","outgoingShape":"P6"}],"container":"G1"},{"id":"E26","sources":["P53"],"targets":["P19"],"sections":[{"id":"E26_s0","startPoint":{"x":563.0,"y":485.3333333333333},"endPoint":{"x":637.0,"y":274.0},"bendPoints":[{"x":627.0,"y":485.3333333333333},{"x":627.0,"y":274.0}],"incomingShape":"P53","outgoingShape":"P19"}],"junctionPoints":[{"x":627.0,"y":485.3333333333333},{"x":627.0,"y":274.0}],"container":"G1"},{"id":"E27","sources":["P54"],"targets":["P44"],"sections":[{"id":"E27_s0","startPoint":{"x":310.0,"y":387.0},"endPoint":{"x":369.0,"y":327.0},"bendPoints":[{"x":348.0,"y":387.0},{"x":348.0,"y":327.0}],"incomingShape":"P54","outgoingShape":"P44"}],"container":"G1"}]}

perf/model_parity_tickets/report.md

## Drift Samples

- `tickets/core/056_portLabelPlacement.elkt`: diffs=2 [coordinate=2], first: children[0]/ports[0]/y: number mismatch (55.0 != 35.0)
- `tickets/core/299_surroundingPortSpace.elkt`: diffs=1 [coordinate=1], first: children[0]/height: number mismatch (40.0 != 20.0)
- `tickets/core/491_portSpacing.elkt`: diffs=4 [coordinate=2, section=2], first: children[0]/ports[1]/y: number mismatch (37.0 != 38.0)
- `tickets/core/562_insideSelfLoopAlgorithmResolving.elkt`: diffs=6 [coordinate=3, section=3], first: children[0]/ports[0]/y: number mismatch (12.0 != 0.0)
- `tickets/layered/079_selfLoopLabels.elkt`: diffs=1 [ordering=1], first: edges[0]/sections[0]/bendPoints: array length mismatch (4 != 2)
- `tickets/layered/082_unfortunateEdgeLabelSideSelection.elkt`: diffs=20 [section=14, label=4, coordinate=2], first: children[1]/x: number mismatch (15.0 != 12.0)
- `tickets/layered/128_selfLoopLabelSpacing_complex.elkt`: diffs=20 [section=10, label=7, coordinate=3], first: children[0]/y: number mismatch (192.0 != 120.0)
- `tickets/layered/128_selfLoopLabelSpacing_simple.elkt`: diffs=7 [section=4, coordinate=1, label=1, other=1], first: children[0]/y: number mismatch (52.0 != 34.0)
- `tickets/layered/167_insidePortLabelsInHierarchicalGraphs.elkt`: diffs=4 [coordinate=2, section=1, other=1], first: children[1]/edges[1]/sections[0]/endPoint/x: number mismatch (4.0 != 24.0)
- `tickets/layered/193_hierarchicalPortOverlaps.elkt`: diffs=7 [coordinate=4, structure=1, section=1, other=1], first: children[0]/edges[0]/sections[0]: missing keys on right: bendPoints
- `tickets/layered/194_excessiveWhiteSpace.elkt`: diffs=20 [section=9, coordinate=8, ordering=2, structure=1], first: children[0]/children[0]/y: number mismatch (153.0 != 72.0)
- `tickets/layered/213_componentsCompaction.elkt`: diffs=20 [coordinate=20], first: children[0]/children[0]/x: number mismatch (12.5 != 12.0)
- `tickets/layered/273_insideSelfLoopsWithLabels.elkt`: diffs=15 [coordinate=7, section=4, label=2, other=2], first: children[0]/children[0]/ports[0]/x: number mismatch (0.0 != -20.0)
- `tickets/layered/288_selfLoopsCauseNPE_a.elkt`: diffs=17 [section=9, coordinate=5, other=2, ordering=1], first: children[0]/y: number mismatch (24.0 != 49.0)
- `tickets/layered/288_selfLoopsCauseNPE_b.elkt`: diffs=20 [section=11, coordinate=7, ordering=1, structure=1], first: children[0]/children[0]/children[0]/y: number mismatch (22.0 != 32.0)
- `tickets/layered/297_sameSideInsideSelfLoop.elkt`: diffs=11 [coordinate=4, section=4, other=2, structure=1], first: children[0]/height: number mismatch (74.0 != 100.0)
- `tickets/layered/298_selfLoopsCauseAIOOBE.elkt`: diffs=14 [coordinate=7, section=4, other=2, structure=1], first: children[0]/height: number mismatch (44.0 != 100.0)
- `tickets/layered/302_brokenSplineSelfLoops.elkt`: diffs=6 [section=2, other=2, coordinate=1, ordering=1], first: children[0]/x: number mismatch (23.333333333333332 != 27.0)
- `tickets/layered/304_wrongMinimumNodeSize.elkt`: diffs=20 [coordinate=10, section=8, structure=2], first: children[0]/y: number mismatch (47.0 != 12.0)
- `tickets/layered/308_hyperedgeMerging.elkt`: diffs=17 [section=12, coordinate=2, structure=1, ordering=1, other=1], first: children[1]/y: number mismatch (23.0 != 33.0)