perf/model_parity_full/java/layout/realworld/ptolemy/hierarchical/ptolemy_electricpowersystem_GeneratorRegulatorProtectorWithProcessor.elkt.json

{"id":"G1","children":[{"id":"N1","labels":[{"text":"TimedPlotter","id":"L1","x":0.0,"y":-20.0,"width":74.0,"height":15.0}],"ports":[{"id":"P1","layoutOptions":{"org.eclipse.elk.port.side":"WEST","org.eclipse.elk.port.index":"0"},"x":-8.0,"y":16.5,"width":8.0,"height":8.0}],"layoutOptions":{"org.eclipse.elk.portConstraints":"FIXED_ORDER","org.eclipse.elk.nodeLabels.placement":"[H_LEFT, V_TOP, OUTSIDE]"},"x":499.0,"y":288.5,"width":41.0,"height":41.0},{"id":"N2","labels":[{"text":"GeneratorContactorLoad","id":"L2","x":0.0,"y":-20.0,"width":142.0,"height":15.0}],"ports":[{"id":"P2","layoutOptions":{"org.eclipse.elk.port.side":"EAST","org.eclipse.elk.port.index":"0"},"x":82.0,"y":26.666666666666668,"width":8.0,"height":8.0},{"id":"P3","layoutOptions":{"org.eclipse.elk.port.side":"EAST","org.eclipse.elk.port.index":"1"},"x":82.0,"y":61.33333333333334,"width":8.0,"height":8.0},{"id":"P4","layoutOptions":{"org.eclipse.elk.port.side":"WEST","org.eclipse.elk.port.index":"-2"},"x":-8.0,"y":44.0,"width":8.0,"height":8.0}],"layoutOptions":{"org.eclipse.elk.portConstraints":"FREE","org.eclipse.elk.nodeLabels.placement":"[H_LEFT, V_TOP, OUTSIDE]"},"x":329.0,"y":243.66666666666666,"width":82.0,"height":96.0},{"id":"N3","labels":[{"text":"SingleEvent","id":"L3","x":0.0,"y":-20.0,"width":68.0,"height":15.0}],"ports":[{"id":"P5","layoutOptions":{"org.eclipse.elk.port.side":"EAST","org.eclipse.elk.port.index":"0"},"x":66.0,"y":19.0,"width":8.0,"height":8.0}],"layoutOptions":{"org.eclipse.elk.portConstraints":"FIXED_ORDER","org.eclipse.elk.nodeLabels.placement":"[H_LEFT, V_TOP, OUTSIDE]"},"x":12.0,"y":268.66666666666663,"width":66.0,"height":46.0},{"id":"N4","labels":[{"text":"Expression","id":"L4","x":0.0,"y":-20.0,"width":66.0,"height":15.0}],"ports":[{"id":"P6","layoutOptions":{"org.eclipse.elk.port.side":"EAST","org.eclipse.elk.port.index":"0"},"x":197.0,"y":8.5,"width":8.0,"height":8.0},{"id":"P7","layoutOptions":{"org.eclipse.elk.port.side":"WEST","org.eclipse.elk.port.index":"-1"},"x":-8.0,"y":8.5,"width":8.0,"height":8.0}],"layoutOptions":{"org.eclipse.elk.portConstraints":"FIXED_ORDER","org.eclipse.elk.nodeLabels.placement":"[H_LEFT, V_TOP, OUTSIDE]"},"x":499.0,"y":369.5,"width":197.0,"height":25.0},{"id":"N5","labels":[{"text":"Supervisor","id":"L5","x":0.0,"y":-20.0,"width":61.0,"height":15.0}],"ports":[{"id":"P8","layoutOptions":{"org.eclipse.elk.port.side":"WEST","org.eclipse.elk.port.index":"0"},"x":-8.0,"y":16.5,"width":8.0,"height":8.0},{"id":"P9","layoutOptions":{"org.eclipse.elk.port.side":"SOUTH","org.eclipse.elk.port.index":"-1"},"x":26.5,"y":41.0,"width":8.0,"height":8.0},{"id":"P10","layoutOptions":{"org.eclipse.elk.port.side":"EAST","org.eclipse.elk.port.index":"2"},"x":61.0,"y":16.5,"width":8.0,"height":8.0}],"layoutOptions":{"org.eclipse.elk.portConstraints":"FIXED_ORDER","org.eclipse.elk.nodeLabels.placement":"[H_LEFT, V_TOP, OUTSIDE]"},"x":114.0,"y":271.16666666666663,"width":61.0,"height":41.0},{"id":"N6","labels":[{"text":"1Processor","id":"L6","x":0.0,"y":-20.0,"width":67.0,"height":15.0}],"children":[{"id":"N7","labels":[{"text":"in1","id":"L7","x":0.0,"y":-20.0,"width":18.0,"height":15.0}],"ports":[{"id":"P11","layoutOptions":{"org.eclipse.elk.port.side":"EAST","org.eclipse.elk.port.index":"0"},"x":60.0,"y":16.0,"width":8.0,"height":8.0}],"layoutOptions":{"org.eclipse.elk.portConstraints":"FIXED_ORDER","org.eclipse.elk.nodeLabels.placement":"[H_LEFT, V_TOP, OUTSIDE]"},"x":12.0,"y":32.5,"width":60.0,"height":40.0},{"id":"N8","labels":[{"text":"Server","id":"L8","x":0.0,"y":-20.0,"width":37.0,"height":15.0}],"ports":[{"id":"P12","layoutOptions":{"org.eclipse.elk.port.side":"WEST","org.eclipse.elk.port.index":"0"},"x":-8.0,"y":14.0,"width":8.0,"height":8.0},{"id":"P13","layoutOptions":{"org.eclipse.elk.port.side":"EAST","org.eclipse.elk.port.index":"1"},"x":67.0,"y":14.0,"width":8.0,"height":8.0},{"id":"P14","layoutOptions":{"org.eclipse.elk.port.side":"SOUTH","org.eclipse.elk.port.index":"-2"},"x":17.0,"y":36.0,"width":8.0,"height":8.0},{"id":"P15","layoutOptions":{"org.eclipse.elk.port.side":"SOUTH","org.eclipse.elk.port.index":"-3"},"x":42.0,"y":36.0,"width":8.0,"height":8.0}],"layoutOptions":{"org.eclipse.elk.portConstraints":"FIXED_ORDER","org.eclipse.elk.nodeLabels.placement":"[H_LEFT, V_TOP, OUTSIDE]"},"x":322.0,"y":34.5,"width":67.0,"height":36.0},{"id":"N9","labels":[{"text":"RecordDisassembler","id":"L9","x":0.0,"y":-20.0,"width":121.0,"height":15.0}],"ports":[{"id":"P16","layoutOptions":{"org.eclipse.elk.port.side":"WEST","org.eclipse.elk.port.index":"0"},"x":-8.0,"y":16.5,"width":8.0,"height":8.0},{"id":"P17","layoutOptions":{"org.eclipse.elk.port.side":"EAST","org.eclipse.elk.port.index":"1"},"x":10.0,"y":16.5,"width":8.0,"height":8.0}],"layoutOptions":{"org.eclipse.elk.portConstraints":"FIXED_ORDER","org.eclipse.elk.nodeLabels.placement":"[H_LEFT, V_TOP, OUTSIDE]"},"x":173.0,"y":83.5,"width":10.0,"height":41.0},{"id":"N10","labels":[{"text":"in2","id":"L10","x":0.0,"y":-20.0,"width":18.0,"height":15.0}],"ports":[{"id":"P18","layoutOptions":{"org.eclipse.elk.port.side":"EAST","org.eclipse.elk.port.index":"0"},"x":60.0,"y":16.0,"width":8.0,"height":8.0}],"layoutOptions":{"org.eclipse.elk.portConstraints":"FIXED_ORDER","org.eclipse.elk.nodeLabels.placement":"[H_LEFT, V_TOP, OUTSIDE]"},"x":12.0,"y":112.5,"width":60.0,"height":40.0},{"id":"N11","labels":[{"text":"Merge","id":"L11","x":0.0,"y":-20.0,"width":37.0,"height":15.0}],"ports":[{"id":"P19","layoutOptions":{"org.eclipse.elk.port.side":"WEST","org.eclipse.elk.port.index":"0"},"x":-8.0,"y":16.5,"width":8.0,"height":8.0},{"id":"P20","layoutOptions":{"org.eclipse.elk.port.side":"EAST","org.eclipse.elk.port.index":"1"},"x":21.0,"y":16.5,"width":8.0,"height":8.0}],"layoutOptions":{"org.eclipse.elk.portConstraints":"FIXED_ORDER","org.eclipse.elk.nodeLabels.placement":"[H_LEFT, V_TOP, OUTSIDE]"},"x":108.0,"y":32.0,"width":21.0,"height":41.0},{"id":"N12","labels":[{"text":"ExecutionResponsePort","id":"L12","x":0.0,"y":-20.0,"width":140.0,"height":15.0}],"ports":[{"id":"P21","layoutOptions":{"org.eclipse.elk.port.side":"WEST","org.eclipse.elk.port.index":"0"},"x":-8.0,"y":16.0,"width":8.0,"height":8.0}],"layoutOptions":{"org.eclipse.elk.portConstraints":"FIXED_ORDER","org.eclipse.elk.nodeLabels.placement":"[H_LEFT, V_TOP, OUTSIDE]"},"x":425.0,"y":32.5,"width":60.0,"height":40.0}],"layoutOptions":{"org.eclipse.elk.portConstraints":"FREE","org.eclipse.elk.nodeLabels.placement":"[H_LEFT, V_TOP, OUTSIDE]"},"x":12.0,"y":32.0,"width":577.0,"height":164.5,"edges":[{"id":"E10","sources":["P11"],"targets":["P19"],"sections":[{"id":"E10_s0","startPoint":{"x":80.0,"y":52.5},"endPoint":{"x":100.0,"y":52.5},"incomingShape":"P11","outgoingShape":"P19"}],"container":"N6"},{"id":"E11","sources":["P13"],"targets":["P21"],"sections":[{"id":"E11_s0","startPoint":{"x":397.0,"y":52.5},"endPoint":{"x":417.0,"y":52.5},"incomingShape":"P13","outgoingShape":"P21"}],"container":"N6"},{"id":"E12","sources":["P17"],"targets":["P14"],"sections":[{"id":"E12_s0","startPoint":{"x":191.0,"y":104.0},"endPoint":{"x":343.0,"y":78.5},"bendPoints":[{"x":343.0,"y":104.0}],"incomingShape":"P17","outgoingShape":"P14"}],"container":"N6"},{"id":"E13","sources":["P18"],"targets":["P19"],"sections":[{"id":"E13_s0","startPoint":{"x":80.0,"y":132.5},"endPoint":{"x":100.0,"y":52.5},"bendPoints":[{"x":90.0,"y":132.5},{"x":90.0,"y":52.5}],"incomingShape":"P18","outgoingShape":"P19"}],"junctionPoints":[{"x":90.0,"y":52.5}],"container":"N6"},{"id":"E14","sources":["P20"],"targets":["P12"],"sections":[{"id":"E14_s0","startPoint":{"x":137.0,"y":52.5},"endPoint":{"x":314.0,"y":52.5},"incomingShape":"P20","outgoingShape":"P12"}],"container":"N6"},{"id":"E15","sources":["P20"],"targets":["P16"],"sections":[{"id":"E15_s0","startPoint":{"x":137.0,"y":52.5},"endPoint":{"x":165.0,"y":104.0},"bendPoints":[{"x":155.0,"y":52.5},{"x":155.0,"y":104.0}],"incomingShape":"P20","outgoingShape":"P16"}],"junctionPoints":[{"x":155.0,"y":52.5}],"container":"N6"}]},{"id":"N13","labels":[{"text":"2Processors","id":"L13","x":0.0,"y":-20.0,"width":73.0,"height":15.0}],"children":[{"id":"N14","labels":[{"text":"in1","id":"L14","x":0.0,"y":-20.0,"width":18.0,"height":15.0}],"ports":[{"id":"P22","layoutOptions":{"org.eclipse.elk.port.side":"EAST","org.eclipse.elk.port.index":"0"},"x":60.0,"y":16.0,"width":8.0,"height":8.0}],"layoutOptions":{"org.eclipse.elk.portConstraints":"FIXED_ORDER","org.eclipse.elk.nodeLabels.placement":"[H_LEFT, V_TOP, OUTSIDE]"},"x":12.0,"y":32.0,"width":60.0,"height":40.0},{"id":"N15","labels":[{"text":"Server","id":"L15","x":0.0,"y":-20.0,"width":37.0,"height":15.0}],"ports":[{"id":"P23","layoutOptions":{"org.eclipse.elk.port.side":"WEST","org.eclipse.elk.port.index":"0"},"x":-8.0,"y":14.0,"width":8.0,"height":8.0},{"id":"P24","layoutOptions":{"org.eclipse.elk.port.side":"EAST","org.eclipse.elk.port.index":"1"},"x":67.0,"y":14.0,"width":8.0,"height":8.0},{"id":"P25","layoutOptions":{"org.eclipse.elk.port.side":"SOUTH","org.eclipse.elk.port.index":"-2"},"x":17.0,"y":36.0,"width":8.0,"height":8.0},{"id":"P26","layoutOptions":{"org.eclipse.elk.port.side":"SOUTH","org.eclipse.elk.port.index":"-3"},"x":42.0,"y":36.0,"width":8.0,"height":8.0}],"layoutOptions":{"org.eclipse.elk.portConstraints":"FIXED_ORDER","org.eclipse.elk.nodeLabels.placement":"[H_LEFT, V_TOP, OUTSIDE]"},"x":257.0,"y":34.0,"width":67.0,"height":36.0},{"id":"N16","labels":[{"text":"RecordDisassembler","id":"L16","x":0.0,"y":-20.0,"width":121.0,"height":15.0}],"ports":[{"id":"P27","layoutOptions":{"org.eclipse.elk.port.side":"WEST","org.eclipse.elk.port.index":"0"},"x":-8.0,"y":16.5,"width":8.0,"height":8.0},{"id":"P28","layoutOptions":{"org.eclipse.elk.port.side":"EAST","org.eclipse.elk.port.index":"1"},"x":10.0,"y":16.5,"width":8.0,"height":8.0}],"layoutOptions":{"org.eclipse.elk.portConstraints":"FIXED_ORDER","org.eclipse.elk.nodeLabels.placement":"[H_LEFT, V_TOP, OUTSIDE]"},"x":108.0,"y":83.0,"width":10.0,"height":41.0},{"id":"N17","labels":[{"text":"in2","id":"L17","x":0.0,"y":-20.0,"width":18.0,"height":15.0}],"ports":[{"id":"P29","layoutOptions":{"org.eclipse.elk.port.side":"EAST","org.eclipse.elk.port.index":"0"},"x":60.0,"y":16.0,"width":8.0,"height":8.0}],"layoutOptions":{"org.eclipse.elk.portConstraints":"FIXED_ORDER","org.eclipse.elk.nodeLabels.placement":"[H_LEFT, V_TOP, OUTSIDE]"},"x":12.0,"y":164.0,"width":60.0,"height":40.0},{"id":"N18","labels":[{"text":"Server2","id":"L18","x":0.0,"y":-20.0,"width":44.0,"height":15.0}],"ports":[{"id":"P30","layoutOptions":{"org.eclipse.elk.port.side":"WEST","org.eclipse.elk.port.index":"0"},"x":-8.0,"y":14.0,"width":8.0,"height":8.0},{"id":"P31","layoutOptions":{"org.eclipse.elk.port.side":"EAST","org.eclipse.elk.port.index":"1"},"x":67.0,"y":14.0,"width":8.0,"height":8.0},{"id":"P32","layoutOptions":{"org.eclipse.elk.port.side":"SOUTH","org.eclipse.elk.port.index":"-2"},"x":17.0,"y":36.0,"width":8.0,"height":8.0},{"id":"P33","layoutOptions":{"org.eclipse.elk.port.side":"SOUTH","org.eclipse.elk.port.index":"-3"},"x":42.0,"y":36.0,"width":8.0,"height":8.0}],"layoutOptions":{"org.eclipse.elk.portConstraints":"FIXED_ORDER","org.eclipse.elk.nodeLabels.placement":"[H_LEFT, V_TOP, OUTSIDE]"},"x":264.0,"y":166.0,"width":67.0,"height":36.0},{"id":"N19","labels":[{"text":"RecordDisassembler2","id":"L19","x":0.0,"y":-20.0,"width":128.0,"height":15.0}],"ports":[{"id":"P34","layoutOptions":{"org.eclipse.elk.port.side":"WEST","org.eclipse.elk.port.index":"0"},"x":-8.0,"y":16.5,"width":8.0,"height":8.0},{"id":"P35","layoutOptions":{"org.eclipse.elk.port.side":"EAST","org.eclipse.elk.port.index":"1"},"x":10.0,"y":16.5,"width":8.0,"height":8.0}],"layoutOptions":{"org.eclipse.elk.portConstraints":"FIXED_ORDER","org.eclipse.elk.nodeLabels.placement":"[H_LEFT, V_TOP, OUTSIDE]"},"x":108.0,"y":215.0,"width":10.0,"height":41.0},{"id":"N20","labels":[{"text":"ExecutionResponsePort","id":"L20","x":0.0,"y":-20.0,"width":140.0,"height":15.0}],"ports":[{"id":"P36","layoutOptions":{"org.eclipse.elk.port.side":"WEST","org.eclipse.elk.port.index":"0"},"x":-8.0,"y":16.0,"width":8.0,"height":8.0}],"layoutOptions":{"org.eclipse.elk.portConstraints":"FIXED_ORDER","org.eclipse.elk.nodeLabels.placement":"[H_LEFT, V_TOP, OUTSIDE]"},"x":360.0,"y":32.0,"width":60.0,"height":40.0},{"id":"N21","labels":[{"text":"ExecutionResponsePort2","id":"L21","x":0.0,"y":-20.0,"width":148.0,"height":15.0}],"ports":[{"id":"P37","layoutOptions":{"org.eclipse.elk.port.side":"WEST","org.eclipse.elk.port.index":"0"},"x":-8.0,"y":16.0,"width":8.0,"height":8.0}],"layoutOptions":{"org.eclipse.elk.portConstraints":"FIXED_ORDER","org.eclipse.elk.nodeLabels.placement":"[H_LEFT, V_TOP, OUTSIDE]"},"x":367.0,"y":164.0,"width":60.0,"height":40.0}],"layoutOptions":{"org.eclipse.elk.portConstraints":"FREE","org.eclipse.elk.nodeLabels.placement":"[H_LEFT, V_TOP, OUTSIDE]"},"x":12.0,"y":445.5,"width":527.0,"height":268.0,"edges":[{"id":"E16","sources":["P22"],"targets":["P23"],"sections":[{"id":"E16_s0","startPoint":{"x":80.0,"y":52.0},"endPoint":{"x":249.0,"y":52.0},"incomingShape":"P22","outgoingShape":"P23"}],"container":"N13"},{"id":"E17","sources":["P22"],"targets":["P27"],"sections":[{"id":"E17_s0","startPoint":{"x":80.0,"y":52.0},"endPoint":{"x":100.0,"y":103.5},"bendPoints":[{"x":90.0,"y":52.0},{"x":90.0,"y":103.5}],"incomingShape":"P22","outgoingShape":"P27"}],"junctionPoints":[{"x":90.0,"y":52.0}],"container":"N13"},{"id":"E18","sources":["P24"],"targets":["P36"],"sections":[{"id":"E18_s0","startPoint":{"x":332.0,"y":52.0},"endPoint":{"x":352.0,"y":52.0},"incomingShape":"P24","outgoingShape":"P36"}],"container":"N13"},{"id":"E19","sources":["P28"],"targets":["P25"],"sections":[{"id":"E19_s0","startPoint":{"x":126.0,"y":103.5},"endPoint":{"x":278.0,"y":78.0},"bendPoints":[{"x":278.0,"y":103.5}],"incomingShape":"P28","outgoingShape":"P25"}],"container":"N13"},{"id":"E20","sources":["P29"],"targets":["P30"],"sections":[{"id":"E20_s0","startPoint":{"x":80.0,"y":184.0},"endPoint":{"x":256.0,"y":184.0},"incomingShape":"P29","outgoingShape":"P30"}],"container":"N13"},{"id":"E21","sources":["P29"],"targets":["P34"],"sections":[{"id":"E21_s0","startPoint":{"x":80.0,"y":184.0},"endPoint":{"x":100.0,"y":235.5},"bendPoints":[{"x":90.0,"y":184.0},{"x":90.0,"y":235.5}],"incomingShape":"P29","outgoingShape":"P34"}],"junctionPoints":[{"x":90.0,"y":184.0}],"container":"N13"},{"id":"E22","sources":["P31"],"targets":["P37"],"sections":[{"id":"E22_s0","startPoint":{"x":339.0,"y":184.0},"endPoint":{"x":359.0,"y":184.0},"incomingShape":"P31","outgoingShape":"P37"}],"container":"N13"},{"id":"E23","sources":["P35"],"targets":["P32"],"sections":[{"id":"E23_s0","startPoint":{"x":126.0,"y":235.5},"endPoint":{"x":285.0,"y":210.0},"bendPoints":[{"x":285.0,"y":235.5}],"incomingShape":"P35","outgoingShape":"P32"}],"container":"N13"}]},{"id":"N22","labels":[{"text":"MicrostepDelay","id":"L22","x":0.0,"y":-20.0,"width":90.0,"height":15.0}],"ports":[{"id":"P38","layoutOptions":{"org.eclipse.elk.port.side":"WEST","org.eclipse.elk.port.index":"0"},"x":-8.0,"y":10.0,"width":8.0,"height":8.0},{"id":"P39","layoutOptions":{"org.eclipse.elk.port.side":"EAST","org.eclipse.elk.port.index":"1"},"x":31.0,"y":10.0,"width":8.0,"height":8.0}],"layoutOptions":{"org.eclipse.elk.portConstraints":"FIXED_ORDER","org.eclipse.elk.nodeLabels.placement":"[H_LEFT, V_TOP, OUTSIDE]"},"x":211.0,"y":277.66666666666663,"width":31.0,"height":28.0},{"id":"N23","labels":[{"text":"Controller","id":"L23","x":0.0,"y":-20.0,"width":56.0,"height":15.0}],"ports":[{"id":"P40","layoutOptions":{"org.eclipse.elk.port.side":"WEST","org.eclipse.elk.port.index":"0"},"x":-8.0,"y":-2.0,"width":8.0,"height":8.0},{"id":"P41","layoutOptions":{"org.eclipse.elk.port.side":"WEST","org.eclipse.elk.port.index":"-1"},"x":-8.0,"y":4.0,"width":8.0,"height":8.0}],"layoutOptions":{"org.eclipse.elk.portConstraints":"FREE","org.eclipse.elk.nodeLabels.placement":"[H_LEFT, V_TOP, OUTSIDE]"},"x":499.0,"y":236.5,"width":10.0,"height":10.0}],"layoutOptions":{"org.eclipse.elk.portConstraints":"FREE","org.eclipse.elk.randomSeed":"1"},"x":0.0,"y":0.0,"width":726.0,"height":725.5,"edges":[{"id":"E1","sources":["P3"],"targets":["P1"],"sections":[{"id":"E1_s0","startPoint":{"x":419.0,"y":309.0},"endPoint":{"x":491.0,"y":309.0},"incomingShape":"P3","outgoingShape":"P1"}],"container":"G1"},{"id":"E2","sources":["P3"],"targets":["P7"],"sections":[{"id":"E2_s0","startPoint":{"x":419.0,"y":309.0},"endPoint":{"x":491.0,"y":382.0},"bendPoints":[{"x":481.0,"y":309.0},{"x":481.0,"y":382.0}],"incomingShape":"P3","outgoingShape":"P7"}],"container":"G1"},{"id":"E3","sources":["P3"],"targets":["P41"],"sections":[{"id":"E3_s0","startPoint":{"x":419.0,"y":309.0},"endPoint":{"x":491.0,"y":244.5},"bendPoints":[{"x":481.0,"y":309.0},{"x":481.0,"y":244.5}],"incomingShape":"P3","outgoingShape":"P41"}],"junctionPoints":[{"x":481.0,"y":244.5}],"container":"G1"},{"id":"E4","sources":["P2"],"targets":["P1"],"sections":[{"id":"E4_s0","startPoint":{"x":419.0,"y":274.3333333333333},"endPoint":{"x":491.0,"y":309.0},"bendPoints":[{"x":481.0,"y":274.3333333333333},{"x":481.0,"y":309.0}],"incomingShape":"P2","outgoingShape":"P1"}],"junctionPoints":[{"x":481.0,"y":274.3333333333333},{"x":481.0,"y":309.0}],"container":"G1"},{"id":"E5","sources":["P2"],"targets":["P40"],"sections":[{"id":"E5_s0","startPoint":{"x":419.0,"y":274.3333333333333},"endPoint":{"x":491.0,"y":238.5},"bendPoints":[{"x":481.0,"y":274.3333333333333},{"x":481.0,"y":238.5}],"incomingShape":"P2","outgoingShape":"P40"}],"container":"G1"},{"id":"E6","sources":["P5"],"targets":["P8"],"sections":[{"id":"E6_s0","startPoint":{"x":86.0,"y":291.66666666666663},"endPoint":{"x":106.0,"y":291.66666666666663},"incomingShape":"P5","outgoingShape":"P8"}],"container":"G1"},{"id":"E7","sources":["P6"],"targets":["P9"],"sections":[{"id":"E7_s0","startPoint":{"x":704.0,"y":382.0},"endPoint":{"x":144.5,"y":320.16666666666663},"bendPoints":[{"x":714.0,"y":382.0},{"x":714.0,"y":404.5},{"x":144.5,"y":404.5}],"incomingShape":"P6","outgoingShape":"P9"}],"container":"G1"},{"id":"E8","sources":["P10"],"targets":["P38"],"sections":[{"id":"E8_s0","startPoint":{"x":183.0,"y":291.66666666666663},"endPoint":{"x":203.0,"y":291.66666666666663},"incomingShape":"P10","outgoingShape":"P38"}],"container":"G1"},{"id":"E9","sources":["P39"],"targets":["P4"],"sections":[{"id":"E9_s0","startPoint":{"x":250.0,"y":291.66666666666663},"endPoint":{"x":321.0,"y":291.66666666666663},"incomingShape":"P39","outgoingShape":"P4"}],"container":"G1"}]}

perf/model_parity/report.md

## Drift Samples

- `examples/hierarchy/hierarchicalEdges.elkt`: diffs=9 [coordinate=6, other=2, structure=1], first: children[0]/children[0]/x: number mismatch (17.0 != 12.0)
- `examples/hierarchy/hierarchicalLayoutMixing.elkt`: diffs=20 [coordinate=10, section=8, structure=2], first: children[0]/children[0]/x: number mismatch (17.0 != 44.558860981188595)
- `examples/labels/portLabelsMulti.elkt`: diffs=4 [label=4], first: children[1]/ports[2]/labels[0]/y: number mismatch (1.0 != -31.0)
- `examples/user-hints/interactive-constraints/interactiveLayeredLayout_circle.elkt`: diffs=18 [section=12, coordinate=4, structure=1, other=1], first: children[0]/y: number mismatch (12.0 != 17.5)
- `examples/user-hints/interactive-constraints/interactiveLayeredLayout_hierarchyDirection.elkt`: diffs=20 [section=12, coordinate=7, structure=1], first: children[0]/x: number mismatch (52.0 != 62.0)
- `examples/user-hints/interactive-constraints/interactiveLayeredLayout_hierarchyDirection_pseudo_positions.elkt`: diffs=20 [section=12, coordinate=7, structure=1], first: children[0]/x: number mismatch (52.0 != 62.0)
- `examples/user-hints/interactive-constraints/interactiveLayeredLayout_hierarchy_pseudo_positions.elkt`: diffs=8 [coordinate=4, section=4], first: children[0]/x: number mismatch (76.0 != 12.0)
- `examples/user-hints/interactive-constraints/interactiveLayeredLayout_motor.elkt`: diffs=20 [section=11, coordinate=9], first: children[0]/x: number mismatch (82.0 != 72.0)
- `examples/user-hints/interactive-constraints/interactiveLayeredLayout_separateComponents_pseudo_positions.elkt`: diffs=8 [coordinate=3, section=3, other=2], first: children[0]/y: number mismatch (32.0 != 12.0)
- `examples/user-hints/interactive-constraints/interactiveLayeredLayout_simpleDirectionTest.elkt`: diffs=16 [section=12, coordinate=4], first: children[0]/y: number mismatch (12.0 != 32.0)
- `examples/user-hints/interactive-constraints/interactiveLayeredLayout_simpleDirectionTest_pseudo_positions.elkt`: diffs=16 [section=12, coordinate=4], first: children[0]/y: number mismatch (12.0 != 32.0)
- `examples/user-hints/interactive-constraints/interactiveLayeredLayout_snake_pseudo_positions.elkt`: diffs=20 [coordinate=20], first: children[1]/x: number mismatch (132.0 != 192.0)
- `examples/user-hints/interactive-constraints/interactiveLayeredLayout_sortingTask.elkt`: diffs=20 [section=10, coordinate=9, structure=1], first: children[0]/x: number mismatch (62.0 != 72.0)
- `examples/user-hints/interactive-constraints/interactiveLayeredLayout_sortingTask_pseudo_positions.elkt`: diffs=20 [coordinate=12, section=6, structure=2], first: children[0]/x: number mismatch (12.0 != 82.0)
- `examples/user-hints/interactive-constraints/interactiveLayout_mixedHierarchy.elkt`: diffs=8 [coordinate=6, other=2], first: children[0]/x: number mismatch (15.0 != 12.0)
- `examples/user-hints/interactive-constraints/interactiveRectpacking_hierarchy.elkt`: diffs=12 [coordinate=10, other=2], first: children[0]/x: number mismatch (15.0 != 12.0)
- `examples/user-hints/interactive-constraints/interactiveRectpacking_oneBigNode.elkt`: diffs=16 [coordinate=14, other=2], first: children[0]/x: number mismatch (15.0 != 12.0)
- `examples/user-hints/layered/horizontalOrder.elkt`: diffs=20 [coordinate=10, section=8, structure=2], first: children[1]/children[0]/x: number mismatch (32.0 != 12.0)
- `examples/user-hints/layered/partitioning.elkt`: diffs=20 [coordinate=18, section=2], first: children[0]/children[0]/y: number mismatch (86.0 != 96.0)
- `examples/user-hints/layered/reverseEdge.elkt`: diffs=20 [section=12, coordinate=6, structure=2], first: children[0]/children[0]/x: number mismatch (52.0 != 72.0)