perf/model_parity_full/java/layout/realworld/ptolemy/hierarchical/ptera_simultaneouscarwash_SimultaneousCarWash.elkg.json

{"id":"G1","children":[{"id":"N1","labels":[{"text":"InitQueue1","id":"L1","x":0.0,"y":-20.0,"width":63.0,"height":15.0}],"ports":[{"id":"P1","layoutOptions":{"org.eclipse.elk.port.side":"EAST","org.eclipse.elk.port.index":"0"},"x":18.0,"y":8.5,"width":8.0,"height":8.0},{"id":"P2","layoutOptions":{"org.eclipse.elk.port.side":"WEST","org.eclipse.elk.port.index":"-1"},"x":-8.0,"y":8.5,"width":8.0,"height":8.0}],"layoutOptions":{"org.eclipse.elk.portConstraints":"FIXED_ORDER","org.eclipse.elk.nodeLabels.placement":"[H_LEFT, V_TOP, OUTSIDE]"},"x":119.0,"y":85.1,"width":18.0,"height":25.0},{"id":"N2","labels":[{"text":"InitServers1","id":"L2","x":0.0,"y":-20.0,"width":68.0,"height":15.0}],"ports":[{"id":"P3","layoutOptions":{"org.eclipse.elk.port.side":"EAST","org.eclipse.elk.port.index":"0"},"x":18.0,"y":8.5,"width":8.0,"height":8.0},{"id":"P4","layoutOptions":{"org.eclipse.elk.port.side":"WEST","org.eclipse.elk.port.index":"-1"},"x":-8.0,"y":8.5,"width":8.0,"height":8.0}],"layoutOptions":{"org.eclipse.elk.portConstraints":"FIXED_ORDER","org.eclipse.elk.nodeLabels.placement":"[H_LEFT, V_TOP, OUTSIDE]"},"x":114.0,"y":238.76666666666665,"width":18.0,"height":25.0},{"id":"N3","labels":[{"text":"PteraModalModel","id":"L3","x":0.0,"y":-20.0,"width":101.0,"height":15.0}],"ports":[{"id":"P5","layoutOptions":{"org.eclipse.elk.port.side":"WEST","org.eclipse.elk.port.index":"0"},"x":-8.0,"y":215.26666666666665,"width":8.0,"height":8.0},{"id":"P6","layoutOptions":{"org.eclipse.elk.port.side":"WEST","org.eclipse.elk.port.index":"-1"},"x":-8.0,"y":61.6,"width":8.0,"height":8.0},{"id":"P7","layoutOptions":{"org.eclipse.elk.port.side":"EAST","org.eclipse.elk.port.index":"2"},"x":680.0,"y":215.26666666666665,"width":8.0,"height":8.0},{"id":"P8","layoutOptions":{"org.eclipse.elk.port.side":"EAST","org.eclipse.elk.port.index":"3"},"x":680.0,"y":233.26666666666665,"width":8.0,"height":8.0}],"children":[{"id":"N4","labels":[{"text":"queueOutput","id":"L4","x":0.0,"y":-20.0,"width":74.0,"height":15.0}],"ports":[{"id":"P9","layoutOptions":{"org.eclipse.elk.port.side":"WEST","org.eclipse.elk.port.index":"0"},"x":-0.0,"y":16.8,"width":0.0,"height":0.0},{"id":"P10","layoutOptions":{"org.eclipse.elk.port.side":"WEST","org.eclipse.elk.port.index":"-1"},"x":-0.0,"y":33.6,"width":0.0,"height":0.0},{"id":"P11","layoutOptions":{"org.eclipse.elk.port.side":"SOUTH","org.eclipse.elk.port.index":"-2"},"x":-0.0,"y":67.2,"width":0.0,"height":0.0},{"id":"P12","layoutOptions":{"org.eclipse.elk.port.side":"SOUTH","org.eclipse.elk.port.index":"-3"},"x":-0.0,"y":50.400000000000006,"width":0.0,"height":0.0}],"children":[{"id":"N5","labels":[{"text":"Run","id":"L5","x":0.0,"y":-20.0,"width":24.0,"height":15.0}],"ports":[{"id":"P13","layoutOptions":{"org.eclipse.elk.port.side":"EAST","org.eclipse.elk.port.index":"0"},"x":60.0,"y":16.0,"width":8.0,"height":8.0}],"layoutOptions":{"org.eclipse.elk.portConstraints":"FIXED_ORDER","org.eclipse.elk.nodeLabels.placement":"[H_LEFT, V_TOP, OUTSIDE]"},"x":12.0,"y":32.0,"width":60.0,"height":40.0},{"id":"N6","labels":[{"text":"Simulate","id":"L6","x":0.0,"y":-20.0,"width":52.0,"height":15.0}],"ports":[{"id":"P14","layoutOptions":{"org.eclipse.elk.port.side":"WEST","org.eclipse.elk.port.index":"0"},"x":-8.0,"y":16.0,"width":8.0,"height":8.0}],"layoutOptions":{"org.eclipse.elk.portConstraints":"FIXED_ORDER","org.eclipse.elk.nodeLabels.placement":"[H_LEFT, V_TOP, OUTSIDE]"},"x":210.0,"y":32.0,"width":60.0,"height":40.0},{"id":"N7","labels":[{"text":"WaitForInput","id":"L7","x":0.0,"y":-20.0,"width":74.0,"height":15.0}],"ports":[{"id":"P15","layoutOptions":{"org.eclipse.elk.port.side":"WEST","org.eclipse.elk.port.index":"0"},"x":-8.0,"y":16.0,"width":8.0,"height":8.0},{"id":"P16","layoutOptions":{"org.eclipse.elk.port.side":"EAST","org.eclipse.elk.port.index":"1"},"x":60.0,"y":16.0,"width":8.0,"height":8.0}],"layoutOptions":{"org.eclipse.elk.portConstraints":"FIXED_ORDER","org.eclipse.elk.nodeLabels.placement":"[H_LEFT, V_TOP, OUTSIDE]"},"x":108.0,"y":32.0,"width":60.0,"height":40.0}],"layoutOptions":{"org.eclipse.elk.portConstraints":"FREE","org.eclipse.elk.nodeLabels.placement":"[H_LEFT, V_TOP, OUTSIDE]"},"x":386.0,"y":32.0,"width":282.0,"height":84.0,"edges":[{"id":"E19","sources":["P13"],"targets":["P15"],"sections":[{"id":"E19_s0","startPoint":{"x":80.0,"y":52.0},"endPoint":{"x":100.0,"y":52.0},"incomingShape":"P13","outgoingShape":"P15"}],"container":"N4"},{"id":"E20","sources":["P16"],"targets":["P14"],"sections":[{"id":"E20_s0","startPoint":{"x":176.0,"y":52.0},"endPoint":{"x":202.0,"y":52.0},"incomingShape":"P16","outgoingShape":"P14"}],"container":"N4"},{"id":"E21","sources":["P16"],"targets":["P14"],"sections":[{"id":"E21_s0","startPoint":{"x":176.0,"y":52.0},"endPoint":{"x":202.0,"y":52.0},"incomingShape":"P16","outgoingShape":"P14"}],"container":"N4"}]},{"id":"N8","labels":[{"text":"queueOutput","id":"L8","x":0.0,"y":-20.0,"width":74.0,"height":15.0}],"ports":[{"id":"P17","layoutOptions":{"org.eclipse.elk.port.side":"WEST","org.eclipse.elk.port.index":"0"},"x":-0.0,"y":122.66666666666667,"width":0.0,"height":0.0},{"id":"P18","layoutOptions":{"org.eclipse.elk.port.side":"WEST","org.eclipse.elk.port.index":"-1"},"x":-0.0,"y":61.333333333333336,"width":0.0,"height":0.0},{"id":"P19","layoutOptions":{"org.eclipse.elk.port.side":"EAST","org.eclipse.elk.port.index":"2"},"x":314.0,"y":122.66666666666667,"width":0.0,"height":0.0},{"id":"P20","layoutOptions":{"org.eclipse.elk.port.side":"EAST","org.eclipse.elk.port.index":"3"},"x":314.0,"y":61.333333333333336,"width":0.0,"height":0.0}],"children":[{"id":"N9","labels":[{"text":"Enter","id":"L9","x":0.0,"y":-20.0,"width":32.0,"height":15.0}],"ports":[{"id":"P21","layoutOptions":{"org.eclipse.elk.port.side":"WEST","org.eclipse.elk.port.index":"0"},"x":-8.0,"y":16.0,"width":8.0,"height":8.0},{"id":"P22","layoutOptions":{"org.eclipse.elk.port.side":"EAST","org.eclipse.elk.port.index":"1"},"x":60.0,"y":16.0,"width":8.0,"height":8.0}],"layoutOptions":{"org.eclipse.elk.portConstraints":"FIXED_ORDER","org.eclipse.elk.nodeLabels.placement":"[H_LEFT, V_TOP, OUTSIDE]"},"x":118.0,"y":42.0,"width":60.0,"height":40.0},{"id":"N10","labels":[{"text":"Start","id":"L10","x":0.0,"y":-20.0,"width":28.0,"height":15.0}],"ports":[{"id":"P23","layoutOptions":{"org.eclipse.elk.port.side":"WEST","org.eclipse.elk.port.index":"0"},"x":-8.0,"y":16.0,"width":8.0,"height":8.0},{"id":"P24","layoutOptions":{"org.eclipse.elk.port.side":"EAST","org.eclipse.elk.port.index":"1"},"x":60.0,"y":16.0,"width":8.0,"height":8.0}],"layoutOptions":{"org.eclipse.elk.portConstraints":"FIXED_ORDER","org.eclipse.elk.nodeLabels.placement":"[H_LEFT, V_TOP, OUTSIDE]"},"x":224.0,"y":42.0,"width":60.0,"height":40.0},{"id":"N11","labels":[{"text":"Leave","id":"L11","x":0.0,"y":-20.0,"width":34.0,"height":15.0}],"ports":[{"id":"P25","layoutOptions":{"org.eclipse.elk.port.side":"WEST","org.eclipse.elk.port.index":"0"},"x":-8.0,"y":16.0,"width":8.0,"height":8.0},{"id":"P26","layoutOptions":{"org.eclipse.elk.port.side":"EAST","org.eclipse.elk.port.index":"1"},"x":60.0,"y":16.0,"width":8.0,"height":8.0}],"layoutOptions":{"org.eclipse.elk.portConstraints":"FIXED_ORDER","org.eclipse.elk.nodeLabels.placement":"[H_LEFT, V_TOP, OUTSIDE]"},"x":118.0,"y":122.0,"width":60.0,"height":40.0},{"id":"N12","labels":[{"text":"Init","id":"L12","x":0.0,"y":-20.0,"width":17.0,"height":15.0}],"ports":[{"id":"P27","layoutOptions":{"org.eclipse.elk.port.side":"EAST","org.eclipse.elk.port.index":"0"},"x":60.0,"y":16.0,"width":8.0,"height":8.0}],"layoutOptions":{"org.eclipse.elk.portConstraints":"FIXED_ORDER","org.eclipse.elk.nodeLabels.placement":"[H_LEFT, V_TOP, OUTSIDE]"},"x":12.0,"y":42.0,"width":60.0,"height":40.0}],"layoutOptions":{"org.eclipse.elk.portConstraints":"FREE","org.eclipse.elk.nodeLabels.placement":"[H_LEFT, V_TOP, OUTSIDE]"},"x":42.0,"y":96.6,"width":314.0,"height":184.0,"edges":[{"id":"E22","sources":["P22"],"targets":["P23"],"sections":[{"id":"E22_s0","startPoint":{"x":186.0,"y":62.0},"endPoint":{"x":216.0,"y":62.0},"incomingShape":"P22","outgoingShape":"P23"}],"container":"N8"},{"id":"E23","sources":["P22"],"targets":["P21"],"sections":[{"id":"E23_s0","startPoint":{"x":186.0,"y":62.0},"endPoint":{"x":110.0,"y":62.0},"bendPoints":[{"x":196.0,"y":62.0},{"x":196.0,"y":12.0},{"x":100.0,"y":12.0},{"x":100.0,"y":62.0}],"incomingShape":"P22","outgoingShape":"P21"}],"container":"N8"},{"id":"E24","sources":["P24"],"targets":["P25"],"sections":[{"id":"E24_s0","startPoint":{"x":292.0,"y":62.0},"endPoint":{"x":110.0,"y":142.0},"bendPoints":[{"x":302.0,"y":62.0},{"x":302.0,"y":172.0},{"x":90.0,"y":172.0},{"x":90.0,"y":142.0}],"incomingShape":"P24","outgoingShape":"P25"}],"container":"N8"},{"id":"E25","sources":["P26"],"targets":["P23"],"sections":[{"id":"E25_s0","startPoint":{"x":186.0,"y":142.0},"endPoint":{"x":216.0,"y":62.0},"bendPoints":[{"x":206.0,"y":142.0},{"x":206.0,"y":62.0}],"incomingShape":"P26","outgoingShape":"P23"}],"junctionPoints":[{"x":206.0,"y":62.0}],"container":"N8"},{"id":"E26","sources":["P27"],"targets":["P21"],"sections":[{"id":"E26_s0","startPoint":{"x":80.0,"y":62.0},"endPoint":{"x":110.0,"y":62.0},"incomingShape":"P27","outgoingShape":"P21"}],"container":"N8"}]}],"layoutOptions":{"org.eclipse.elk.portConstraints":"FREE","org.eclipse.elk.nodeLabels.placement":"[H_LEFT, V_TOP, OUTSIDE]"},"x":210.0,"y":32.0,"width":680.0,"height":292.6,"edges":[{"id":"E11","sources":["P5"],"targets":["P9"],"sections":[{"id":"E11_s0","startPoint":{"x":0.0,"y":219.26666666666665},"endPoint":{"x":386.0,"y":48.8},"bendPoints":[{"x":22.0,"y":219.26666666666665},{"x":22.0,"y":48.8}],"incomingShape":"P5","outgoingShape":"P9"}],"junctionPoints":[{"x":22.0,"y":219.26666666666665}],"container":"N3"},{"id":"E12","sources":["P5"],"targets":["P17"],"sections":[{"id":"E12_s0","startPoint":{"x":0.0,"y":219.26666666666665},"endPoint":{"x":42.0,"y":219.26666666666665},"incomingShape":"P5","outgoingShape":"P17"}],"container":"N3"},{"id":"E13","sources":["P6"],"targets":["P10"],"sections":[{"id":"E13_s0","startPoint":{"x":0.0,"y":65.6},"endPoint":{"x":386.0,"y":65.6},"incomingShape":"P6","outgoingShape":"P10"}],"container":"N3"},{"id":"E14","sources":["P6"],"targets":["P18"],"sections":[{"id":"E14_s0","startPoint":{"x":0.0,"y":65.6},"endPoint":{"x":42.0,"y":157.93333333333334},"bendPoints":[{"x":32.0,"y":65.6},{"x":32.0,"y":157.93333333333334}],"incomingShape":"P6","outgoingShape":"P18"}],"junctionPoints":[{"x":32.0,"y":65.6}],"container":"N3"},{"id":"E15","sources":["P19"],"targets":["P7"],"sections":[{"id":"E15_s0","startPoint":{"x":356.0,"y":219.26666666666665},"endPoint":{"x":680.0,"y":219.26666666666665},"incomingShape":"P19","outgoingShape":"P7"}],"container":"N3"},{"id":"E16","sources":["P19"],"targets":["P11"],"sections":[{"id":"E16_s0","startPoint":{"x":356.0,"y":219.26666666666665},"endPoint":{"x":386.0,"y":99.2},"bendPoints":[{"x":376.0,"y":219.26666666666665},{"x":376.0,"y":99.2}],"incomingShape":"P19","outgoingShape":"P11"}],"junctionPoints":[{"x":376.0,"y":219.26666666666665}],"container":"N3"},{"id":"E17","sources":["P20"],"targets":["P8"],"sections":[{"id":"E17_s0","startPoint":{"x":356.0,"y":157.93333333333334},"endPoint":{"x":680.0,"y":237.26666666666665},"bendPoints":[{"x":366.0,"y":157.93333333333334},{"x":366.0,"y":237.26666666666665}],"incomingShape":"P20","outgoingShape":"P8"}],"container":"N3"},{"id":"E18","sources":["P20"],"targets":["P12"],"sections":[{"id":"E18_s0","startPoint":{"x":356.0,"y":157.93333333333334},"endPoint":{"x":386.0,"y":82.4},"bendPoints":[{"x":366.0,"y":157.93333333333334},{"x":366.0,"y":82.4}],"incomingShape":"P20","outgoingShape":"P12"}],"junctionPoints":[{"x":366.0,"y":157.93333333333334}],"container":"N3"}]},{"id":"N13","labels":[{"text":"InitServers2","id":"L13","x":0.0,"y":-20.0,"width":68.0,"height":15.0}],"ports":[{"id":"P28","layoutOptions":{"org.eclipse.elk.port.side":"EAST","org.eclipse.elk.port.index":"0"},"x":18.0,"y":8.5,"width":8.0,"height":8.0},{"id":"P29","layoutOptions":{"org.eclipse.elk.port.side":"WEST","org.eclipse.elk.port.index":"-1"},"x":-8.0,"y":8.5,"width":8.0,"height":8.0}],"layoutOptions":{"org.eclipse.elk.portConstraints":"FIXED_ORDER","org.eclipse.elk.nodeLabels.placement":"[H_LEFT, V_TOP, OUTSIDE]"},"x":114.0,"y":303.76666666666665,"width":18.0,"height":25.0},{"id":"N14","labels":[{"text":"InitQueue2","id":"L14","x":0.0,"y":-20.0,"width":63.0,"height":15.0}],"ports":[{"id":"P30","layoutOptions":{"org.eclipse.elk.port.side":"EAST","org.eclipse.elk.port.index":"0"},"x":18.0,"y":8.5,"width":8.0,"height":8.0},{"id":"P31","layoutOptions":{"org.eclipse.elk.port.side":"WEST","org.eclipse.elk.port.index":"-1"},"x":-8.0,"y":8.5,"width":8.0,"height":8.0}],"layoutOptions":{"org.eclipse.elk.portConstraints":"FIXED_ORDER","org.eclipse.elk.nodeLabels.placement":"[H_LEFT, V_TOP, OUTSIDE]"},"x":119.0,"y":150.1,"width":18.0,"height":25.0},{"id":"N15","labels":[{"text":"TimedPlotter","id":"L15","x":0.0,"y":-20.0,"width":74.0,"height":15.0}],"ports":[{"id":"P32","layoutOptions":{"org.eclipse.elk.port.side":"WEST","org.eclipse.elk.port.index":"0"},"x":-8.0,"y":16.5,"width":8.0,"height":8.0}],"layoutOptions":{"org.eclipse.elk.portConstraints":"FIXED_ORDER","org.eclipse.elk.nodeLabels.placement":"[H_LEFT, V_TOP, OUTSIDE]"},"x":926.0,"y":230.76666666666665,"width":41.0,"height":41.0},{"id":"N16","labels":[{"text":"SingleEvent","id":"L16","x":0.0,"y":-20.0,"width":68.0,"height":15.0}],"ports":[{"id":"P33","layoutOptions":{"org.eclipse.elk.port.side":"EAST","org.eclipse.elk.port.index":"0"},"x":66.0,"y":19.0,"width":8.0,"height":8.0}],"layoutOptions":{"org.eclipse.elk.portConstraints":"FIXED_ORDER","org.eclipse.elk.nodeLabels.placement":"[H_LEFT, V_TOP, OUTSIDE]"},"x":12.0,"y":139.6,"width":66.0,"height":46.0}],"layoutOptions":{"org.eclipse.elk.portConstraints":"FREE","org.eclipse.elk.randomSeed":"1"},"x":0.0,"y":0.0,"width":1012.0,"height":340.76666666666665,"edges":[{"id":"E1","sources":["P1"],"targets":["P6"],"sections":[{"id":"E1_s0","startPoint":{"x":145.0,"y":97.6},"endPoint":{"x":202.0,"y":97.6},"incomingShape":"P1","outgoingShape":"P6"}],"container":"G1"},{"id":"E2","sources":["P3"],"targets":["P5"],"sections":[{"id":"E2_s0","startPoint":{"x":140.0,"y":251.26666666666665},"endPoint":{"x":202.0,"y":251.26666666666665},"incomingShape":"P3","outgoingShape":"P5"}],"container":"G1"},{"id":"E3","sources":["P7"],"targets":["P32"],"sections":[{"id":"E3_s0","startPoint":{"x":898.0,"y":251.26666666666665},"endPoint":{"x":918.0,"y":251.26666666666665},"incomingShape":"P7","outgoingShape":"P32"}],"container":"G1"},{"id":"E4","sources":["P8"],"targets":["P32"],"sections":[{"id":"E4_s0","startPoint":{"x":898.0,"y":269.26666666666665},"endPoint":{"x":918.0,"y":251.26666666666665},"bendPoints":[{"x":908.0,"y":269.26666666666665},{"x":908.0,"y":251.26666666666665}],"incomingShape":"P8","outgoingShape":"P32"}],"junctionPoints":[{"x":908.0,"y":251.26666666666665}],"container":"G1"},{"id":"E5","sources":["P28"],"targets":["P5"],"sections":[{"id":"E5_s0","startPoint":{"x":140.0,"y":316.26666666666665},"endPoint":{"x":202.0,"y":251.26666666666665},"bendPoints":[{"x":192.0,"y":316.26666666666665},{"x":192.0,"y":251.26666666666665}],"incomingShape":"P28","outgoingShape":"P5"}],"junctionPoints":[{"x":192.0,"y":251.26666666666665}],"container":"G1"},{"id":"E6","sources":["P30"],"targets":["P6"],"sections":[{"id":"E6_s0","startPoint":{"x":145.0,"y":162.6},"endPoint":{"x":202.0,"y":97.6},"bendPoints":[{"x":192.0,"y":162.6},{"x":192.0,"y":97.6}],"incomingShape":"P30","outgoingShape":"P6"}],"junctionPoints":[{"x":192.0,"y":97.6}],"container":"G1"},{"id":"E7","sources":["P33"],"targets":["P2"],"sections":[{"id":"E7_s0","startPoint":{"x":86.0,"y":162.6},"endPoint":{"x":111.0,"y":97.6},"bendPoints":[{"x":96.0,"y":162.6},{"x":96.0,"y":97.6}],"incomingShape":"P33","outgoingShape":"P2"}],"junctionPoints":[{"x":96.0,"y":162.6}],"container":"G1"},{"id":"E8","sources":["P33"],"targets":["P4"],"sections":[{"id":"E8_s0","startPoint":{"x":86.0,"y":162.6},"endPoint":{"x":106.0,"y":251.26666666666665},"bendPoints":[{"x":96.0,"y":162.6},{"x":96.0,"y":251.26666666666665}],"incomingShape":"P33","outgoingShape":"P4"}],"junctionPoints":[{"x":96.0,"y":251.26666666666665}],"container":"G1"},{"id":"E9","sources":["P33"],"targets":["P29"],"sections":[{"id":"E9_s0","startPoint":{"x":86.0,"y":162.6},"endPoint":{"x":106.0,"y":316.26666666666665},"bendPoints":[{"x":96.0,"y":162.6},{"x":96.0,"y":316.26666666666665}],"incomingShape":"P33","outgoingShape":"P29"}],"container":"G1"},{"id":"E10","sources":["P33"],"targets":["P31"],"sections":[{"id":"E10_s0","startPoint":{"x":86.0,"y":162.6},"endPoint":{"x":111.0,"y":162.6},"incomingShape":"P33","outgoingShape":"P31"}],"container":"G1"}]}

perf/model_parity_examples/report.md

## Drift Samples

- `examples/edges/insideSelfLoops.elkt`: diffs=18 [section=16, coordinate=2], first: children[0]/y: number mismatch (22.0 != 12.0)
- `examples/hierarchy/hierarchicalEdges.elkt`: diffs=11 [coordinate=8, other=2, structure=1], first: children[0]/children[0]/height: number mismatch (24.0 != 0.0)
- `examples/hierarchy/hierarchicalLayoutMixing.elkt`: diffs=20 [coordinate=12, section=6, structure=2], first: children[0]/children[0]/height: number mismatch (24.0 != 0.0)
- `examples/labels/portLabelsMulti.elkt`: diffs=4 [label=4], first: children[1]/ports[2]/labels[0]/y: number mismatch (1.0 != -31.0)
- `examples/user-hints/interactive-constraints/interactiveLayeredLayout_circle.elkt`: diffs=18 [section=12, coordinate=4, structure=1, other=1], first: children[0]/y: number mismatch (12.0 != 17.5)
- `examples/user-hints/interactive-constraints/interactiveLayeredLayout_hierarchyDirection.elkt`: diffs=20 [section=12, coordinate=7, structure=1], first: children[0]/x: number mismatch (52.0 != 62.0)
- `examples/user-hints/interactive-constraints/interactiveLayeredLayout_motor.elkt`: diffs=20 [section=11, coordinate=9], first: children[0]/x: number mismatch (82.0 != 72.0)
- `examples/user-hints/interactive-constraints/interactiveLayeredLayout_simpleDirectionTest.elkt`: diffs=16 [section=12, coordinate=4], first: children[0]/y: number mismatch (12.0 != 32.0)
- `examples/user-hints/interactive-constraints/interactiveLayeredLayout_sortingTask.elkt`: diffs=20 [section=10, coordinate=9, structure=1], first: children[0]/x: number mismatch (62.0 != 72.0)
- `examples/user-hints/interactive-constraints/interactiveLayout_mixedHierarchy.elkt`: diffs=8 [coordinate=6, other=2], first: children[0]/x: number mismatch (15.0 != 12.0)
- `examples/user-hints/interactive-constraints/interactiveRectpacking_hierarchy.elkt`: diffs=12 [coordinate=10, other=2], first: children[0]/x: number mismatch (15.0 != 12.0)
- `examples/user-hints/interactive-constraints/interactiveRectpacking_oneBigNode.elkt`: diffs=16 [coordinate=14, other=2], first: children[0]/x: number mismatch (15.0 != 12.0)
- `examples/user-hints/layered/partitioning.elkt`: diffs=20 [coordinate=18, section=2], first: children[0]/children[0]/y: number mismatch (86.0 != 96.0)
- `examples/user-hints/layered/reverseEdge.elkt`: diffs=20 [section=12, coordinate=6, structure=2], first: children[0]/children[0]/x: number mismatch (52.0 != 72.0)
- `examples/user-hints/layered/verticalOrder.elkt`: diffs=20 [coordinate=9, section=9, structure=1, label=1], first: children[0]/children[0]/y: number mismatch (32.0 != 42.0)
- `examples/user-hints/model-order/modelOrderCycleBreaking.elkt`: diffs=20 [section=13, coordinate=6, structure=1], first: children[0]/children[0]/y: number mismatch (23.0 != 12.0)
- `examples/user-hints/model-order/modelOrderNoCrossingMin.elkt`: diffs=2 [ordering=2], first: edges[2]/sections[0]/bendPoints: array length mismatch (2 != 4)