perf/model_parity_full/java/layout/realworld/ptolemy/hierarchical/gr_pendulum_Pendulum.elkt.json

{"id":"G1","children":[{"id":"N1","labels":[{"text":"Sphere","id":"L1","x":0.0,"y":-20.0,"width":42.0,"height":15.0}],"ports":[{"id":"P1","layoutOptions":{"org.eclipse.elk.port.side":"EAST","org.eclipse.elk.port.index":"0"},"x":60.0,"y":16.0,"width":8.0,"height":8.0}],"layoutOptions":{"org.eclipse.elk.portConstraints":"FIXED_ORDER","org.eclipse.elk.nodeLabels.placement":"[H_LEFT, V_TOP, OUTSIDE]"},"x":12.0,"y":556.0,"width":60.0,"height":40.0},{"id":"N2","labels":[{"text":"Translate","id":"L2","x":0.0,"y":-20.0,"width":54.0,"height":15.0}],"ports":[{"id":"P2","layoutOptions":{"org.eclipse.elk.port.side":"WEST","org.eclipse.elk.port.index":"0"},"x":-8.0,"y":16.0,"width":8.0,"height":8.0},{"id":"P3","layoutOptions":{"org.eclipse.elk.port.side":"EAST","org.eclipse.elk.port.index":"1"},"x":60.0,"y":16.0,"width":8.0,"height":8.0}],"layoutOptions":{"org.eclipse.elk.portConstraints":"FIXED_ORDER","org.eclipse.elk.nodeLabels.placement":"[H_LEFT, V_TOP, OUTSIDE]"},"x":256.0,"y":556.0,"width":60.0,"height":40.0},{"id":"N3","labels":[{"text":"ViewScreen","id":"L3","x":0.0,"y":-20.0,"width":70.0,"height":15.0}],"ports":[{"id":"P4","layoutOptions":{"org.eclipse.elk.port.side":"WEST","org.eclipse.elk.port.index":"0"},"x":-8.0,"y":16.0,"width":8.0,"height":8.0}],"layoutOptions":{"org.eclipse.elk.portConstraints":"FIXED_ORDER","org.eclipse.elk.nodeLabels.placement":"[H_LEFT, V_TOP, OUTSIDE]"},"x":822.0,"y":396.0,"width":60.0,"height":40.0},{"id":"N4","labels":[{"text":"Cylinder","id":"L4","x":0.0,"y":-20.0,"width":48.0,"height":15.0}],"ports":[{"id":"P5","layoutOptions":{"org.eclipse.elk.port.side":"EAST","org.eclipse.elk.port.index":"0"},"x":60.0,"y":16.0,"width":8.0,"height":8.0}],"layoutOptions":{"org.eclipse.elk.portConstraints":"FIXED_ORDER","org.eclipse.elk.nodeLabels.placement":"[H_LEFT, V_TOP, OUTSIDE]"},"x":404.0,"y":476.0,"width":60.0,"height":40.0},{"id":"N5","labels":[{"text":"Rotate","id":"L5","x":0.0,"y":-20.0,"width":39.0,"height":15.0}],"ports":[{"id":"P6","layoutOptions":{"org.eclipse.elk.port.side":"WEST","org.eclipse.elk.port.index":"0"},"x":-8.0,"y":8.0,"width":8.0,"height":8.0},{"id":"P7","layoutOptions":{"org.eclipse.elk.port.side":"EAST","org.eclipse.elk.port.index":"1"},"x":60.0,"y":16.0,"width":8.0,"height":8.0},{"id":"P8","layoutOptions":{"org.eclipse.elk.port.side":"WEST","org.eclipse.elk.port.index":"-2"},"x":-8.0,"y":24.0,"width":8.0,"height":8.0}],"layoutOptions":{"org.eclipse.elk.portConstraints":"FIXED_ORDER","org.eclipse.elk.nodeLabels.placement":"[H_LEFT, V_TOP, OUTSIDE]"},"x":575.3333333333334,"y":564.0,"width":60.0,"height":40.0},{"id":"N6","labels":[{"text":"Text","id":"L6","x":0.0,"y":-20.0,"width":24.0,"height":15.0}],"ports":[{"id":"P9","layoutOptions":{"org.eclipse.elk.port.side":"EAST","org.eclipse.elk.port.index":"0"},"x":60.0,"y":16.0,"width":8.0,"height":8.0}],"layoutOptions":{"org.eclipse.elk.portConstraints":"FIXED_ORDER","org.eclipse.elk.nodeLabels.placement":"[H_LEFT, V_TOP, OUTSIDE]"},"x":12.0,"y":396.0,"width":60.0,"height":40.0},{"id":"N7","labels":[{"text":"Scale3D","id":"L7","x":0.0,"y":-20.0,"width":50.0,"height":15.0}],"ports":[{"id":"P10","layoutOptions":{"org.eclipse.elk.port.side":"WEST","org.eclipse.elk.port.index":"0"},"x":-8.0,"y":16.0,"width":8.0,"height":8.0},{"id":"P11","layoutOptions":{"org.eclipse.elk.port.side":"EAST","org.eclipse.elk.port.index":"1"},"x":60.0,"y":16.0,"width":8.0,"height":8.0}],"layoutOptions":{"org.eclipse.elk.portConstraints":"FIXED_ORDER","org.eclipse.elk.nodeLabels.placement":"[H_LEFT, V_TOP, OUTSIDE]"},"x":256.0,"y":396.0,"width":60.0,"height":40.0},{"id":"N8","labels":[{"text":"Translate2","id":"L8","x":0.0,"y":-20.0,"width":61.0,"height":15.0}],"ports":[{"id":"P12","layoutOptions":{"org.eclipse.elk.port.side":"WEST","org.eclipse.elk.port.index":"0"},"x":-8.0,"y":16.0,"width":8.0,"height":8.0},{"id":"P13","layoutOptions":{"org.eclipse.elk.port.side":"EAST","org.eclipse.elk.port.index":"1"},"x":60.0,"y":16.0,"width":8.0,"height":8.0}],"layoutOptions":{"org.eclipse.elk.portConstraints":"FIXED_ORDER","org.eclipse.elk.nodeLabels.placement":"[H_LEFT, V_TOP, OUTSIDE]"},"x":613.0,"y":396.0,"width":60.0,"height":40.0},{"id":"N9","labels":[{"text":"damped pendulum ODE","id":"L9","x":0.0,"y":-20.0,"width":138.0,"height":15.0}],"ports":[{"id":"P14","layoutOptions":{"org.eclipse.elk.port.side":"EAST","org.eclipse.elk.port.index":"0"},"x":364.0,"y":51.0,"width":8.0,"height":8.0}],"children":[{"id":"N10","labels":[{"text":"Expression","id":"L10","x":0.0,"y":-20.0,"width":66.0,"height":15.0}],"ports":[{"id":"P15","layoutOptions":{"org.eclipse.elk.port.side":"EAST","org.eclipse.elk.port.index":"0"},"x":114.0,"y":8.5,"width":8.0,"height":8.0},{"id":"P16","layoutOptions":{"org.eclipse.elk.port.side":"WEST","org.eclipse.elk.port.index":"-1"},"x":-8.0,"y":3.0,"width":8.0,"height":8.0},{"id":"P17","layoutOptions":{"org.eclipse.elk.port.side":"WEST","org.eclipse.elk.port.index":"-2"},"x":-8.0,"y":14.0,"width":8.0,"height":8.0}],"layoutOptions":{"org.eclipse.elk.portConstraints":"FIXED_ORDER","org.eclipse.elk.nodeLabels.placement":"[H_LEFT, V_TOP, OUTSIDE]"},"x":210.0,"y":115.5,"width":114.0,"height":25.0},{"id":"N11","labels":[{"text":"Periodic Sampler","id":"L11","x":0.0,"y":-20.0,"width":100.0,"height":15.0}],"ports":[{"id":"P18","layoutOptions":{"org.eclipse.elk.port.side":"WEST","org.eclipse.elk.port.index":"0"},"x":-8.0,"y":16.5,"width":8.0,"height":8.0},{"id":"P19","layoutOptions":{"org.eclipse.elk.port.side":"EAST","org.eclipse.elk.port.index":"1"},"x":61.0,"y":16.5,"width":8.0,"height":8.0}],"layoutOptions":{"org.eclipse.elk.portConstraints":"FIXED_ORDER","org.eclipse.elk.nodeLabels.placement":"[H_LEFT, V_TOP, OUTSIDE]"},"x":232.0,"y":34.5,"width":61.0,"height":41.0},{"id":"N12","labels":[{"text":"Integrator1","id":"L12","x":0.0,"y":-20.0,"width":62.0,"height":15.0}],"ports":[{"id":"P20","layoutOptions":{"org.eclipse.elk.port.side":"SOUTH","org.eclipse.elk.port.index":"0"},"x":9.333333333333334,"y":46.0,"width":8.0,"height":8.0},{"id":"P21","layoutOptions":{"org.eclipse.elk.port.side":"WEST","org.eclipse.elk.port.index":"-1"},"x":-8.0,"y":19.0,"width":8.0,"height":8.0},{"id":"P22","layoutOptions":{"org.eclipse.elk.port.side":"EAST","org.eclipse.elk.port.index":"2"},"x":44.0,"y":19.0,"width":8.0,"height":8.0},{"id":"P23","layoutOptions":{"org.eclipse.elk.port.side":"SOUTH","org.eclipse.elk.port.index":"-3"},"x":26.66666666666667,"y":46.0,"width":8.0,"height":8.0}],"layoutOptions":{"org.eclipse.elk.portConstraints":"FIXED_ORDER","org.eclipse.elk.nodeLabels.placement":"[H_LEFT, V_TOP, OUTSIDE]"},"x":30.0,"y":32.0,"width":44.0,"height":46.0},{"id":"N13","labels":[{"text":"Integrator2","id":"L13","x":0.0,"y":-20.0,"width":62.0,"height":15.0}],"ports":[{"id":"P24","layoutOptions":{"org.eclipse.elk.port.side":"SOUTH","org.eclipse.elk.port.index":"0"},"x":9.333333333333334,"y":46.0,"width":8.0,"height":8.0},{"id":"P25","layoutOptions":{"org.eclipse.elk.port.side":"WEST","org.eclipse.elk.port.index":"-1"},"x":-8.0,"y":19.0,"width":8.0,"height":8.0},{"id":"P26","layoutOptions":{"org.eclipse.elk.port.side":"EAST","org.eclipse.elk.port.index":"2"},"x":44.0,"y":19.0,"width":8.0,"height":8.0},{"id":"P27","layoutOptions":{"org.eclipse.elk.port.side":"SOUTH","org.eclipse.elk.port.index":"-3"},"x":26.66666666666667,"y":46.0,"width":8.0,"height":8.0}],"layoutOptions":{"org.eclipse.elk.portConstraints":"FIXED_ORDER","org.eclipse.elk.nodeLabels.placement":"[H_LEFT, V_TOP, OUTSIDE]"},"x":120.0,"y":32.0,"width":44.0,"height":46.0}],"layoutOptions":{"org.eclipse.elk.portConstraints":"FREE","org.eclipse.elk.nodeLabels.placement":"[H_LEFT, V_TOP, OUTSIDE]"},"x":100.0,"y":636.0,"width":364.0,"height":163.5,"edges":[{"id":"E10","sources":["P15"],"targets":["P21"],"sections":[{"id":"E10_s0","startPoint":{"x":332.0,"y":128.0},"endPoint":{"x":22.0,"y":55.0},"bendPoints":[{"x":342.0,"y":128.0},{"x":342.0,"y":150.5},{"x":12.0,"y":150.5},{"x":12.0,"y":55.0}],"incomingShape":"P15","outgoingShape":"P21"}],"container":"N9"},{"id":"E11","sources":["P19"],"targets":["P14"],"sections":[{"id":"E11_s0","startPoint":{"x":301.0,"y":55.0},"endPoint":{"x":364.0,"y":55.0},"incomingShape":"P19","outgoingShape":"P14"}],"container":"N9"},{"id":"E12","sources":["P22"],"targets":["P17"],"sections":[{"id":"E12_s0","startPoint":{"x":82.0,"y":55.0},"endPoint":{"x":202.0,"y":133.5},"bendPoints":[{"x":102.0,"y":55.0},{"x":102.0,"y":133.5}],"incomingShape":"P22","outgoingShape":"P17"}],"junctionPoints":[{"x":102.0,"y":55.0}],"container":"N9"},{"id":"E13","sources":["P22"],"targets":["P25"],"sections":[{"id":"E13_s0","startPoint":{"x":82.0,"y":55.0},"endPoint":{"x":112.0,"y":55.0},"incomingShape":"P22","outgoingShape":"P25"}],"container":"N9"},{"id":"E14","sources":["P26"],"targets":["P16"],"sections":[{"id":"E14_s0","startPoint":{"x":172.0,"y":55.0},"endPoint":{"x":202.0,"y":122.5},"bendPoints":[{"x":192.0,"y":55.0},{"x":192.0,"y":122.5}],"incomingShape":"P26","outgoingShape":"P16"}],"junctionPoints":[{"x":192.0,"y":55.0}],"container":"N9"},{"id":"E15","sources":["P26"],"targets":["P18"],"sections":[{"id":"E15_s0","startPoint":{"x":172.0,"y":55.0},"endPoint":{"x":224.0,"y":55.0},"incomingShape":"P26","outgoingShape":"P18"}],"container":"N9"}]},{"id":"N14","labels":[{"text":"Stage","id":"L14","x":0.0,"y":-20.0,"width":35.0,"height":15.0}],"ports":[{"id":"P28","layoutOptions":{"org.eclipse.elk.port.side":"EAST","org.eclipse.elk.port.index":"0"},"x":294.0,"y":128.0,"width":8.0,"height":8.0}],"children":[{"id":"N15","labels":[{"text":"0:Translate0","id":"L15","x":0.0,"y":-20.0,"width":72.0,"height":15.0}],"ports":[{"id":"P29","layoutOptions":{"org.eclipse.elk.port.side":"WEST","org.eclipse.elk.port.index":"0"},"x":-8.0,"y":16.0,"width":8.0,"height":8.0},{"id":"P30","layoutOptions":{"org.eclipse.elk.port.side":"EAST","org.eclipse.elk.port.index":"1"},"x":60.0,"y":16.0,"width":8.0,"height":8.0}],"layoutOptions":{"org.eclipse.elk.portConstraints":"FIXED_ORDER","org.eclipse.elk.nodeLabels.placement":"[H_LEFT, V_TOP, OUTSIDE]"},"x":113.0,"y":112.0,"width":60.0,"height":40.0},{"id":"N16","labels":[{"text":"0:Translate11","id":"L16","x":0.0,"y":-20.0,"width":78.0,"height":15.0}],"ports":[{"id":"P31","layoutOptions":{"org.eclipse.elk.port.side":"WEST","org.eclipse.elk.port.index":"0"},"x":-8.0,"y":16.0,"width":8.0,"height":8.0},{"id":"P32","layoutOptions":{"org.eclipse.elk.port.side":"EAST","org.eclipse.elk.port.index":"1"},"x":60.0,"y":16.0,"width":8.0,"height":8.0}],"layoutOptions":{"org.eclipse.elk.portConstraints":"FIXED_ORDER","org.eclipse.elk.nodeLabels.placement":"[H_LEFT, V_TOP, OUTSIDE]"},"x":108.0,"y":32.0,"width":60.0,"height":40.0},{"id":"N17","labels":[{"text":"0:Box14","id":"L17","x":0.0,"y":-20.0,"width":49.0,"height":15.0}],"ports":[{"id":"P33","layoutOptions":{"org.eclipse.elk.port.side":"EAST","org.eclipse.elk.port.index":"0"},"x":60.0,"y":16.0,"width":8.0,"height":8.0}],"layoutOptions":{"org.eclipse.elk.portConstraints":"FIXED_ORDER","org.eclipse.elk.nodeLabels.placement":"[H_LEFT, V_TOP, OUTSIDE]"},"x":12.0,"y":32.0,"width":60.0,"height":40.0},{"id":"N18","labels":[{"text":"0:Translate6","id":"L18","x":0.0,"y":-20.0,"width":72.0,"height":15.0}],"ports":[{"id":"P34","layoutOptions":{"org.eclipse.elk.port.side":"WEST","org.eclipse.elk.port.index":"0"},"x":-8.0,"y":16.0,"width":8.0,"height":8.0},{"id":"P35","layoutOptions":{"org.eclipse.elk.port.side":"EAST","org.eclipse.elk.port.index":"1"},"x":60.0,"y":16.0,"width":8.0,"height":8.0}],"layoutOptions":{"org.eclipse.elk.portConstraints":"FIXED_ORDER","org.eclipse.elk.nodeLabels.placement":"[H_LEFT, V_TOP, OUTSIDE]"},"x":113.0,"y":272.0,"width":60.0,"height":40.0},{"id":"N19","labels":[{"text":"0:Box15","id":"L19","x":0.0,"y":-20.0,"width":49.0,"height":15.0}],"ports":[{"id":"P36","layoutOptions":{"org.eclipse.elk.port.side":"EAST","org.eclipse.elk.port.index":"0"},"x":60.0,"y":16.0,"width":8.0,"height":8.0}],"layoutOptions":{"org.eclipse.elk.portConstraints":"FIXED_ORDER","org.eclipse.elk.nodeLabels.placement":"[H_LEFT, V_TOP, OUTSIDE]"},"x":12.0,"y":272.0,"width":60.0,"height":40.0},{"id":"N20","labels":[{"text":"0:Box12","id":"L20","x":0.0,"y":-20.0,"width":49.0,"height":15.0}],"ports":[{"id":"P37","layoutOptions":{"org.eclipse.elk.port.side":"EAST","org.eclipse.elk.port.index":"0"},"x":60.0,"y":16.0,"width":8.0,"height":8.0}],"layoutOptions":{"org.eclipse.elk.portConstraints":"FIXED_ORDER","org.eclipse.elk.nodeLabels.placement":"[H_LEFT, V_TOP, OUTSIDE]"},"x":12.0,"y":192.0,"width":60.0,"height":40.0},{"id":"N21","labels":[{"text":"0:Box13","id":"L21","x":0.0,"y":-20.0,"width":49.0,"height":15.0}],"ports":[{"id":"P38","layoutOptions":{"org.eclipse.elk.port.side":"EAST","org.eclipse.elk.port.index":"0"},"x":60.0,"y":16.0,"width":8.0,"height":8.0}],"layoutOptions":{"org.eclipse.elk.portConstraints":"FIXED_ORDER","org.eclipse.elk.nodeLabels.placement":"[H_LEFT, V_TOP, OUTSIDE]"},"x":12.0,"y":112.0,"width":60.0,"height":40.0},{"id":"N22","labels":[{"text":"0:Translate1","id":"L22","x":0.0,"y":-20.0,"width":72.0,"height":15.0}],"ports":[{"id":"P39","layoutOptions":{"org.eclipse.elk.port.side":"WEST","org.eclipse.elk.port.index":"0"},"x":-8.0,"y":16.0,"width":8.0,"height":8.0},{"id":"P40","layoutOptions":{"org.eclipse.elk.port.side":"EAST","org.eclipse.elk.port.index":"1"},"x":60.0,"y":16.0,"width":8.0,"height":8.0}],"layoutOptions":{"org.eclipse.elk.portConstraints":"FIXED_ORDER","org.eclipse.elk.nodeLabels.placement":"[H_LEFT, V_TOP, OUTSIDE]"},"x":113.0,"y":192.0,"width":60.0,"height":40.0},{"id":"N23","labels":[{"text":"Scale3D0","id":"L23","x":0.0,"y":-20.0,"width":57.0,"height":15.0}],"ports":[{"id":"P41","layoutOptions":{"org.eclipse.elk.port.side":"WEST","org.eclipse.elk.port.index":"0"},"x":-8.0,"y":16.0,"width":8.0,"height":8.0},{"id":"P42","layoutOptions":{"org.eclipse.elk.port.side":"EAST","org.eclipse.elk.port.index":"1"},"x":60.0,"y":16.0,"width":8.0,"height":8.0}],"layoutOptions":{"org.eclipse.elk.portConstraints":"FIXED_ORDER","org.eclipse.elk.nodeLabels.placement":"[H_LEFT, V_TOP, OUTSIDE]"},"x":214.0,"y":112.0,"width":60.0,"height":40.0}],"layoutOptions":{"org.eclipse.elk.portConstraints":"FREE","org.eclipse.elk.nodeLabels.placement":"[H_LEFT, V_TOP, OUTSIDE]"},"x":492.0,"y":32.0,"width":294.0,"height":324.0,"edges":[{"id":"E16","sources":["P30"],"targets":["P41"],"sections":[{"id":"E16_s0","startPoint":{"x":181.0,"y":132.0},"endPoint":{"x":206.0,"y":132.0},"incomingShape":"P30","outgoingShape":"P41"}],"container":"N14"},{"id":"E17","sources":["P32"],"targets":["P41"],"sections":[{"id":"E17_s0","startPoint":{"x":176.0,"y":52.0},"endPoint":{"x":206.0,"y":132.0},"bendPoints":[{"x":196.0,"y":52.0},{"x":196.0,"y":132.0}],"incomingShape":"P32","outgoingShape":"P41"}],"junctionPoints":[{"x":196.0,"y":132.0}],"container":"N14"},{"id":"E18","sources":["P33"],"targets":["P31"],"sections":[{"id":"E18_s0","startPoint":{"x":80.0,"y":52.0},"endPoint":{"x":100.0,"y":52.0},"incomingShape":"P33","outgoingShape":"P31"}],"container":"N14"},{"id":"E19","sources":["P35"],"targets":["P41"],"sections":[{"id":"E19_s0","startPoint":{"x":181.0,"y":292.0},"endPoint":{"x":206.0,"y":132.0},"bendPoints":[{"x":196.0,"y":292.0},{"x":196.0,"y":132.0}],"incomingShape":"P35","outgoingShape":"P41"}],"container":"N14"},{"id":"E20","sources":["P36"],"targets":["P34"],"sections":[{"id":"E20_s0","startPoint":{"x":80.0,"y":292.0},"endPoint":{"x":105.0,"y":292.0},"incomingShape":"P36","outgoingShape":"P34"}],"container":"N14"},{"id":"E21","sources":["P37"],"targets":["P39"],"sections":[{"id":"E21_s0","startPoint":{"x":80.0,"y":212.0},"endPoint":{"x":105.0,"y":212.0},"incomingShape":"P37","outgoingShape":"P39"}],"container":"N14"},{"id":"E22","sources":["P38"],"targets":["P29"],"sections":[{"id":"E22_s0","startPoint":{"x":80.0,"y":132.0},"endPoint":{"x":105.0,"y":132.0},"incomingShape":"P38","outgoingShape":"P29"}],"container":"N14"},{"id":"E23","sources":["P40"],"targets":["P41"],"sections":[{"id":"E23_s0","startPoint":{"x":181.0,"y":212.0},"endPoint":{"x":206.0,"y":132.0},"bendPoints":[{"x":196.0,"y":212.0},{"x":196.0,"y":132.0}],"incomingShape":"P40","outgoingShape":"P41"}],"junctionPoints":[{"x":196.0,"y":212.0}],"container":"N14"},{"id":"E24","sources":["P42"],"targets":["P28"],"sections":[{"id":"E24_s0","startPoint":{"x":282.0,"y":132.0},"endPoint":{"x":294.0,"y":132.0},"incomingShape":"P42","outgoingShape":"P28"}],"container":"N14"}]}],"layoutOptions":{"org.eclipse.elk.portConstraints":"FREE","org.eclipse.elk.randomSeed":"1"},"x":0.0,"y":0.0,"width":904.0,"height":811.5,"edges":[{"id":"E1","sources":["P1"],"targets":["P2"],"sections":[{"id":"E1_s0","startPoint":{"x":80.0,"y":576.0},"endPoint":{"x":248.0,"y":576.0},"incomingShape":"P1","outgoingShape":"P2"}],"container":"G1"},{"id":"E2","sources":["P3"],"targets":["P6"],"sections":[{"id":"E2_s0","startPoint":{"x":324.0,"y":576.0},"endPoint":{"x":567.3333333333334,"y":576.0},"incomingShape":"P3","outgoingShape":"P6"}],"container":"G1"},{"id":"E3","sources":["P5"],"targets":["P6"],"sections":[{"id":"E3_s0","startPoint":{"x":472.0,"y":496.0},"endPoint":{"x":567.3333333333334,"y":576.0},"bendPoints":[{"x":482.0,"y":496.0},{"x":482.0,"y":576.0}],"incomingShape":"P5","outgoingShape":"P6"}],"junctionPoints":[{"x":482.0,"y":576.0}],"container":"G1"},{"id":"E4","sources":["P7"],"targets":["P4"],"sections":[{"id":"E4_s0","startPoint":{"x":643.3333333333334,"y":584.0},"endPoint":{"x":814.0,"y":416.0},"bendPoints":[{"x":804.0,"y":584.0},{"x":804.0,"y":416.0}],"incomingShape":"P7","outgoingShape":"P4"}],"container":"G1"},{"id":"E5","sources":["P9"],"targets":["P10"],"sections":[{"id":"E5_s0","startPoint":{"x":80.0,"y":416.0},"endPoint":{"x":248.0,"y":416.0},"incomingShape":"P9","outgoingShape":"P10"}],"container":"G1"},{"id":"E6","sources":["P11"],"targets":["P12"],"sections":[{"id":"E6_s0","startPoint":{"x":324.0,"y":416.0},"endPoint":{"x":605.0,"y":416.0},"incomingShape":"P11","outgoingShape":"P12"}],"container":"G1"},{"id":"E7","sources":["P13"],"targets":["P4"],"sections":[{"id":"E7_s0","startPoint":{"x":681.0,"y":416.0},"endPoint":{"x":814.0,"y":416.0},"incomingShape":"P13","outgoingShape":"P4"}],"container":"G1"},{"id":"E8","sources":["P14"],"targets":["P8"],"sections":[{"id":"E8_s0","startPoint":{"x":472.0,"y":691.0},"endPoint":{"x":567.3333333333334,"y":592.0},"bendPoints":[{"x":482.0,"y":691.0},{"x":482.0,"y":592.0}],"incomingShape":"P14","outgoingShape":"P8"}],"container":"G1"},{"id":"E9","sources":["P28"],"targets":["P4"],"sections":[{"id":"E9_s0","startPoint":{"x":794.0,"y":164.0},"endPoint":{"x":814.0,"y":416.0},"bendPoints":[{"x":804.0,"y":164.0},{"x":804.0,"y":416.0}],"incomingShape":"P28","outgoingShape":"P4"}],"junctionPoints":[{"x":804.0,"y":416.0}],"container":"G1"}]}

perf/model_parity_tests/report.md

## Drift Samples

- `tests/core/label_placement/port_labels/next_to_port_if_possible_inside.elkt`: diffs=5 [coordinate=4, other=1], first: children[0]/ports[0]/x: number mismatch (4.0 != 24.0)
- `tests/core/label_placement/port_labels/treat_as_group_outside.elkt`: diffs=4 [label=2, coordinate=1, other=1], first: children[0]/height: number mismatch (30.0 != 20.0)
- `tests/core/label_placement/port_labels/variants.elkt`: diffs=20 [coordinate=13, section=4, label=3], first: children[0]/children[0]/x: number mismatch (12.0 != 36.0)
- `tests/core/node_size/inside_port_labels.elkt`: diffs=16 [coordinate=14, label=1, other=1], first: children[0]/height: number mismatch (64.0 != 0.0)
- `tests/layered/compaction_oned/hierarchical_ports/hports1.elkt`: diffs=20 [section=12, coordinate=4, label=4], first: children[0]/children[0]/x: number mismatch (32.0 != 52.0)
- `tests/layered/compaction_oned/labels/edgeLabelAndSplines.elkt`: diffs=20 [section=8, coordinate=6, label=4, ordering=2], first: children[0]/y: number mismatch (20.5 != 19.0)
- `tests/layered/compaction_oned/labels/edgeLabelShouldBeCentered.elkt`: diffs=12 [section=6, coordinate=3, label=2, ordering=1], first: children[0]/y: number mismatch (32.66666666666667 != 15.333333333333334)
- `tests/layered/compaction_oned/labels/edgeLabelSideSelection01.elkt`: diffs=16 [section=8, coordinate=4, label=3, other=1], first: children[0]/y: number mismatch (15.0 != 12.0)
- `tests/layered/compaction_oned/labels/labels1.elkt`: diffs=20 [coordinate=12, section=4, label=3, ordering=1], first: children[0]/x: number mismatch (305.0 != 340.0)
- `tests/layered/compaction_oned/labels/labels2.elkt`: diffs=20 [coordinate=9, section=6, label=4, ordering=1], first: children[0]/x: number mismatch (554.0 != 1021.0)
- `tests/layered/compaction_oned/nsport/south_port.elkt`: diffs=4 [section=2, coordinate=1, other=1], first: children[2]/x: number mismatch (41.3333 != 61.3333)
- `tests/layered/compaction_oned/selfloop/selfloop_crash.elkt`: diffs=20 [section=12, coordinate=6, ordering=2], first: children[0]/y: number mismatch (73.0 != 72.0)
- `tests/layered/compaction_oned/selfloop/selfloop_orthogonal.elkt`: diffs=16 [section=10, coordinate=4, structure=2], first: children[0]/y: number mismatch (42.0 != 12.0)
- `tests/layered/compaction_oned/selfloop/selfloop_spline.elkt`: diffs=20 [section=11, coordinate=6, ordering=3], first: children[0]/y: number mismatch (43.0 != 12.0)
- `tests/layered/compaction_oned/splines/moreThanOneStraightSegmentPath.elkt`: diffs=20 [coordinate=15, section=5], first: children[0]/y: number mismatch (77.5 != 72.5)
- `tests/layered/compaction_oned/splines/moreThanOneStraightSegmentPath2.elkt`: diffs=20 [section=11, coordinate=9], first: children[1]/x: number mismatch (52.0 != 32.0)
- `tests/layered/connected_components/all_four_port_sides.elkt`: diffs=20 [section=12, coordinate=4, structure=4], first: children[0]/children[1]/x: number mismatch (62.0 != 52.0)
- `tests/layered/connected_components/compound02.elkt`: diffs=20 [section=12, coordinate=8], first: children[0]/children[0]/x: number mismatch (12.0 != 34.5)
- `tests/layered/connected_components/compound03.elkt`: diffs=20 [coordinate=20], first: children[0]/children[0]/y: number mismatch (22.0 != 12.0)
- `tests/layered/connected_components/compound04.elkt`: diffs=20 [section=10, coordinate=6, structure=4], first: children[0]/children[1]/x: number mismatch (122.0 != 82.0)